listing_url,canonical_url,list_id,title,description,posted_at,ad_status,is_featured,category_name,price,price_display,currency,price_per_sqft,region,area,state,full_address,postcode,latitude,longitude,transaction_type,property_type,property_sub_type,size_sqft,land_area,land_area_unit,bedrooms,bathrooms,carpark,floor_range,total_floors_unit,furnishing,condition,facing_direction,unit_type,is_tenanted,tenure_type,remaining_tenure,land_title,strata_title,maintenance_fee,assessment_tax,deposit_months,utility_deposit_months,mortgage_estimate,mortgage_rate,facilities_list,nearby_bus_stops,nearby_schools,nearby_parks,nearby_hospitals,nearby_shopping,development_name,development_url,developer,completion_year,total_floors,total_units,image_urls,image_count,seller_name,seller_type,seller_profile_url,seller_logo_url,ren_number,firm_license,is_verified,total_ads,agent_phone,agent_whatsapp,og_title,og_description,og_image,meta_description,source,scraped_at,raw_attributes
https://www.mudah.my/2-storey-link-bungalow-mutiara-rini-skudai-unblock-view-114512298.htm,https://www.mudah.my/2-storey-link-bungalow-mutiara-rini-skudai-unblock-view-114512298.htm,134505832,2 Storey Link Bungalow Mutiara Rini Skudai (UNBLOCK VIEW),"FOR SALE <br><br>Mutiara Rini, Skudai<br>Double Storey Link Bungalow<br>Land Size : 50x55ft (2,750 sqft)<br>4 Bedrooms<br>4 Bathrooms<br>Renovated<br>Partial Furnished<br>Gated & Guarded <br>Unblock View<br>Facing West<br>Easy access to: Perling Area | Bukit Indah | Johor Bahru Town<br>Bank Value RM1.3m <br><br>Selling Price RM1.1m<br><br>Jika berminat boleh hubungi di talian<br>---> Whatsapp : https://wa.me/60167174030/mutiararini1.1m=teamlisting<br>---> Whatsapp : https://wa.me/60167174030/mutiararini1.1m=teamlisting",,,,House,1100000.0,"RM 1,100,000",MYR,,johor,Skudai,Johor,,10572,,,For Sale,bungalow,,2750,,,4,4,,,,,,,,,,,,,,,,,,4.0,,,,,,,,,,,,,"[""https://cdn.rnudah.com/images/plain/d79e475a5fa150c2cc7052ed3575e45c-2980306393281672568.jpg"", ""https://cdn.rnudah.com/images/plain/a1beb4341fbdef7c3fc6ec5ae609f9e4-2980306384842143096.jpg"", ""https://cdn.rnudah.com/images/plain/2ad4f9a937c56e774b42028c204282fa-2980306386978950910.jpg"", ""https://cdn.rnudah.com/images/plain/3ecbeae3e33bf34e8a06bcff6f25da26-2980306385345525112.jpg"", ""https://cdn.rnudah.com/images/plain/f0da3d35a49fc856eec321dc2023c0d5-2980306389103752568.jpg"", ""https://mcdn.mudah.my/static-assets/images/adview/renovated.svg"", ""https://mcdn.mudah.my/static-assets/images/adview/garden.svg"", ""https://mcdn.mudah.my/static-assets/images/adview/road.svg"", ""https://www.facebook.com/tr?id=632307416906311&ev=ViewContent&cd[content_type]=product&cd[content_ids]=114512298&cd[value]=1100000&cd[currency]=MYR&cd[content_category]=2000%20%7C%20properties&noscript=1""]",9,,,,,36423,"E - 10572, REN 36423 All ads from this advertiser (123 For Sale) Mortgage Estimation RM 4,383 Estimated monthly installment (Interest rate 4.0%) Property Price Loan Interest (%) Loan Amount Loan Tenure (Years) * This is for reference only and is not a quote. Results vary according to different financial institutions. Mudah.my doesn't guarantee it's accuracy or applicability to your circumstances. Is this your ad? Manage it using these links: Edit Delete Sold Bump Share This Ad Is this ad suspicious or inappropriate? Report this Ad ( List-ID: 114512298 ) Contact Agent WhatsApp Chat 016717**** MOHD AZLAN BIN ISMAIL Property agent ERA Real Estate Firm: E - 10572, REN 36423 All ads from this advertiser (123 For Sale) Mortgage Estimation RM 4,383 Estimated monthly installment (Interest rate 4.0%) Property Price Loan Interest (%) Loan Amount Loan Tenure (Years) * This is for reference only and is not a quote. Results vary according to different financial institutions. Mudah.my doesn't guarantee it's accuracy or applicability to your circumstances. Is this your ad? Manage it using these links: Edit Delete Sold Bump Share This Ad Is this ad suspicious or inappropriate? Report this Ad ( List-ID: 114512298 ) More picks below Back to Top",,123,,,"Link Bungalow for Sale, 4 Bedroom, 2750 sq.ft, Skudai, Johor 114512298 | Mudah.my","Explore Link Bungalow for Sale for RM 1,100,000 2 Storey Link Bungalow Mutiara Rini Skudai (UNBLOCK VIEW) in Skudai, Johor. 2750 sq.ft, 4 Bedroom, 4 Bathroom, Leasehold, ID 114512298. Find your next property on Mudah.my.",https://cdn.rnudah.com/images/plain/d79e475a5fa150c2cc7052ed3575e45c-2980306393281672568.jpg,"Explore Link Bungalow for Sale for RM 1,100,000 2 Storey Link Bungalow Mutiara Rini Skudai (UNBLOCK VIEW) in Skudai, Johor. 2750 sq.ft, 4 Bedroom, 4 Bathroom, Leasehold, ID 114512298. Find your next property on Mudah.my.",mudah.my,2026-05-29T17:02:33.401362+00:00,
https://www.mudah.my/4-bedrooms-apartment-senai-near-kempas-setia-tropika-freehold-114843022.htm,https://www.mudah.my/4-bedrooms-apartment-senai-near-kempas-setia-tropika-freehold-114843022.htm,134878042,4 Bedrooms Apartment Senai Near Kempas & Setia Tropika | Freehold,"🔥 SPACIOUS 4-BEDROOM APARTMENT IN SENAI 🔥<br>🏡 RARE LARGE-SIZE UNIT — PERFECT FOR FAMILY LIVING!<br><br>Looking for a spacious apartment in the Senai / Kulai area?<br>This is a great opportunity for:<br>✅ Large families<br>✅ Own stay<br>✅ Rental investment<br>✅ First home buyers<br><br>✨ FREE Lawyer Fee<br>✨ FREE Agent Fee<br>✨ ZERO Deposit*<br>✨ Low Booking Fee Only<br><br>Why buyers love this unit:<br>✔ 4 Bedrooms<br>✔ Freehold Property<br>✔ Spacious & Comfortable Layout<br>✔ Fast Growing Location<br>✔ Affordable Price for a Large Unit<br><br>📍 Strategic Location:<br>🚙 ±15 mins to Kempas<br>🚙 ±20 mins to Setia Tropika<br>🚙 ±25 mins to Bandar Dato Onn<br>🚙 Near Senai Airport<br>🚙 Easy Highway Access (Senai Desaru Highway & 2nd Link)<br>🚙 Nearby Shops, Schools, & Daily Amenities<br><br>🔥 Ideal For:<br>✔ Families needing more space<br>✔ Buyers upgrading from smaller apartments<br>✔ Long-term property investment<br><br>⚠️ Large 4-bedroom units in Senai are limited in the market.<br><br>As the area continues to develop,<br>property value & rental demand may continue to increase 📈<br><br>📲 PM NOW for:<br>✔ Latest Price<br>✔ FREE Loan Eligibility Check<br>✔ Unit Photos & Full Details<br><br>📞 Anna / Radz<br>📲 WhatsApp Now:<br>+60 14-568 8436 (Anna)<br>+60 17-7227417 (Radz)<br><br>apartment senai<br>apartment johor bahru<br>4 bilik<br>freehold<br>near kempas<br>setia tropika<br>murah",,,,Apartment / Condominium,312800.0,"RM 312,800",MYR,,johor,Senai,Johor,"Jalan Scientex Jaya 18, Taman Scientex, 81400 Senai, Johor",81400,,,For Sale,apartment,,1036,,,4,3,,,,,,,,,,,,,,,,,,4.0,,,,,,,More on Sentrio Residences @ Senai,https://www.mudah.my/property/properties-in-sentrio-residences-senai-johor,SCIENTEX BERHAD,,,,"[""https://customer-76ekbudsmzsbwunl.cloudflarestream.com/337d0fc7c2d6da9eeef8a388d451ece7/thumbnails/thumbnail.jpg?fit=clip&height=480&width=640"", ""https://cdn.rnudah.com/images/plain/197ca05529cb44e7a3ec8dda68791882-2985661046799789072.jpg"", ""https://cdn.rnudah.com/images/plain/b4a2cf0255e04ce7bc31a443084cb772-2985659604303014928.jpg"", ""https://cdn.rnudah.com/images/plain/f0acea8ee3f61da0117413ff2308021a-2985657201157598224.jpg"", ""https://cdn.rnudah.com/images/plain/d0af347232e10431b9bbdf651027dfc9-2985657200687770640.jpg"", ""https://mcdn.mudah.my/static-assets/images/adview/freehold.svg"", ""https://mcdn.mudah.my/static-assets/images/adview/gooddeal.svg"", ""https://mcdn.mudah.my/static-assets/images/adview/return.svg"", ""https://mcdn.mudah.my/static-assets/images/adview/stores.svg"", ""https://mcdn.mudah.my/static-assets/images/adview/road.svg"", ""https://www.facebook.com/tr?id=632307416906311&ev=ViewContent&cd[content_type]=product&cd[content_ids]=114843022&cd[value]=312800&cd[currency]=MYR&cd[content_category]=2000%20%7C%20properties&noscript=1""]",11,,,,,00000,"E - 11694, REN 00000 All ads from this advertiser (6 For Sale, 1 For Rent) Mortgage Estimation RM 1,246 Estimated monthly installment (Interest rate 4.0%) Property Price Loan Interest (%) Loan Amount Loan Tenure (Years) * This is for reference only and is not a quote. Results vary according to different financial institutions. Mudah.my doesn't guarantee it's accuracy or applicability to your circumstances. Is this your ad? Manage it using these links: Edit Delete Sold Bump Share This Ad Is this ad suspicious or inappropriate? Report this Ad ( List-ID: 114843022 ) Contact Agent WhatsApp Chat Anna Property agent Gplex Realty Firm: E - 11694, REN 00000 All ads from this advertiser (6 For Sale, 1 For Rent) Mortgage Estimation RM 1,246 Estimated monthly installment (Interest rate 4.0%) Property Price Loan Interest (%) Loan Amount Loan Tenure (Years) * This is for reference only and is not a quote. Results vary according to different financial institutions. Mudah.my doesn't guarantee it's accuracy or applicability to your circumstances. Is this your ad? Manage it using these links: Edit Delete Sold Bump Share This Ad Is this ad suspicious or inappropriate? Report this Ad ( List-ID: 114843022 ) More picks below Back to Top",,6,,,"Service Residence for Sale, 4 Bedroom, 1036 sq.ft, Sentrio Residences @ Senai, Senai, Johor 114843022 | Mudah.my","Explore Service Residence for Sale for RM 312,800 in Sentrio Residences @ Senai, Senai, Johor. 1036 sq.ft, 4 Bedroom, 3 Bathroom, Freehold, Parking, Security, Lift, Playground, Gymnasium, Minimart, Jogging Track, ID 114843022. Find your next property on Mudah.my.",https://cdn.rnudah.com/images/plain/197ca05529cb44e7a3ec8dda68791882-2985661046799789072.jpg,"Explore Service Residence for Sale for RM 312,800 in Sentrio Residences @ Senai, Senai, Johor. 1036 sq.ft, 4 Bedroom, 3 Bathroom, Freehold, Parking, Security, Lift, Playground, Gymnasium, Minimart, Jogging Track, ID 114843022. Find your next property on Mudah.my.",mudah.my,2026-05-29T16:19:56.086142+00:00,
https://www.mudah.my/apartment-d-inspire-nusa-bestari-bukit-indah-114271642.htm,https://www.mudah.my/apartment-d-inspire-nusa-bestari-bukit-indah-114271642.htm,134237102,"Apartment D Inspire @ Nusa Bestari, Bukit Indah","For Sale<br><br>Apartment D Inspire @ Nusa Bestari, Bukit Indah, High Floor Blok B<br>- 2 bedroom 2 bathroom<br>- 895 sqft<br>- Freehold<br>- International Lot<br>- ⁠High Floor With Balcony<br>- Fully Furnished & New Paint<br>- ⁠1 carpark<br>- ⁠Unblock View<br>- Maintenance Fees: RM 287.23/month<br>- ⁠Key on hand<br><br>Selling Price : RM 388K<br><br>No Cobroke<br>Please Call or Whatsapp : <br>Tony Lim 0146642918 （REN 43411）<br>https://api.whatsapp.com/send?phone=60146642918",,,,Apartment / Condominium,388000.0,"RM 388,000",MYR,,johor,Johor Bahru,Johor,"Jalan Bestari, 15/2, Taman Nusa Bestari, 81300 Johor Bahru, Johor",43411,,,For Sale,apartment,,895,,,2,2,,,,,,,,,,,,,,,,,,4.0,,,,,,,More on D'Inspire Residence (Inspira Bestari),https://www.mudah.my/property/properties-in-dinspire-residence-inspira-bestari-johor,KHOO SOON LEE REALTY SDN. BHD.,,,,"[""https://cdn.rnudah.com/images/plain/5cb34ce5b13e3582c0407e50ad01de26-2975980692130240291.jpg"", ""https://cdn.rnudah.com/images/plain/1d5415c6ab4853c687c87737910d4ae8-2975980706726614819.jpg"", ""https://cdn.rnudah.com/images/plain/6e75e18de5901097b15dc56e02ba8cc9-2975980707135664010.jpg"", ""https://cdn.rnudah.com/images/plain/c31af85d9e1f56e833fd3fadc76e270c-2975980706345553326.jpg"", ""https://cdn.rnudah.com/images/plain/cd00aa538db6203415a5e1d5fd90659f-2975980708828777902.jpg"", ""https://mcdn.mudah.my/static-assets/images/adview/freehold.svg"", ""https://mcdn.mudah.my/static-assets/images/adview/renovated.svg"", ""https://mcdn.mudah.my/static-assets/images/adview/parking.svg"", ""https://mcdn.mudah.my/static-assets/images/adview/pool.svg"", ""https://mcdn.mudah.my/static-assets/images/adview/panoview.svg"", ""https://mcdn.mudah.my/static-assets/images/adview/balcony.svg"", ""https://www.facebook.com/tr?id=632307416906311&ev=ViewContent&cd[content_type]=product&cd[content_ids]=114271642&cd[value]=388000&cd[currency]=MYR&cd[content_category]=2000%20%7C%20properties&noscript=1""]",12,,,,https://img.rnudah.com/stores/logo_1004748_dee.jpg,43411,"E - 11981, REN 43411 All ads from this advertiser (1 For Sale, 1 For Rent) Mortgage Estimation RM 1,546 Estimated monthly installment (Interest rate 4.0%) Property Price Loan Interest (%) Loan Amount Loan Tenure (Years) * This is for reference only and is not a quote. Results vary according to different financial institutions. Mudah.my doesn't guarantee it's accuracy or applicability to your circumstances. Is this your ad? Manage it using these links: Edit Delete Sold Bump Share This Ad Is this ad suspicious or inappropriate? Report this Ad ( List-ID: 114271642 ) Contact Agent WhatsApp Chat 014664**** Tony Lim Property agent – Agent ID Checked Ceiloz Realty Sdn Bhd Firm: E - 11981, REN 43411 All ads from this advertiser (1 For Sale, 1 For Rent) Mortgage Estimation RM 1,546 Estimated monthly installment (Interest rate 4.0%) Property Price Loan Interest (%) Loan Amount Loan Tenure (Years) * This is for reference only and is not a quote. Results vary according to different financial institutions. Mudah.my doesn't guarantee it's accuracy or applicability to your circumstances. Is this your ad? Manage it using these links: Edit Delete Sold Bump Share This Ad Is this ad suspicious or inappropriate? Report this Ad ( List-ID: 114271642 ) More picks below Back to Top",True,1,,,"Condominium for Sale, 2 Bedroom, 895 sq.ft, D'Inspire Residence (Inspira Bestari), Johor Bahru, Johor 114271642 | Mudah.my","Explore Condominium for Sale for RM 388,000 in D'Inspire Residence (Inspira Bestari), Johor Bahru, Johor. 895 sq.ft, 2 Bedroom, 2 Bathroom, Freehold, Parking, Security, Lift, Swimming Pool, Playground, Gymnasium, Sauna, Barbeque area, Multipurpose hall, Jogging Track, ID 114271642. Find your next property on Mudah.my.",https://cdn.rnudah.com/images/plain/5cb34ce5b13e3582c0407e50ad01de26-2975980692130240291.jpg,"Explore Condominium for Sale for RM 388,000 in D'Inspire Residence (Inspira Bestari), Johor Bahru, Johor. 895 sq.ft, 2 Bedroom, 2 Bathroom, Freehold, Parking, Security, Lift, Swimming Pool, Playground, Gymnasium, Sauna, Barbeque area, Multipurpose hall, Jogging Track, ID 114271642. Find your next property on Mudah.my.",mudah.my,2026-05-29T16:37:28.554377+00:00,
https://www.mudah.my/apartment-villa-krystal-bdr-selesa-jaya-skudai-level-12-4-bilik-114337230.htm,https://www.mudah.my/apartment-villa-krystal-bdr-selesa-jaya-skudai-level-12-4-bilik-114337230.htm,134310570,"APARTMENT VILLA KRYSTAL, BDR SELESA JAYA, SKUDAI - Level 12 / 4 BILIK","APARTMENT FOR SALE<br>@ VILLA KRYSTAL, BANDAR SELESA JAYA, SKUDAI<br>======================================<br><br>PROPERTY DETAILS<br>===============<br>Jalan Silat Lincah, Bandar Selesa Jaya, Skudai<br>Apartment<br>Blok B, Level 12<br>Size : 920 sqft<br>4 Bedrooms / 2 Bathrooms <br>Bumi Lot / Freehold<br>Gated and Guarded<br><br>AMENITIES & ACCESBILITY<br>====================<br>-190m to SMK Taman Selesa Jaya <br>-1.1km to SMK Taman Selesa Jaya 2<br>-1.1km to SK Taman Skudai Baru 2<br>-500m to Sekolah Agama Bandar<br>-600m to Pasaraya Everjoy<br>-2.1km to Masjid Bukit Indah 1<br>-7eleven and shoplot<br><br>* Urusan loan / pembiayaan (BANK / LPPSA) akan diuruskan sepenuhnya.<br>* Tiada kos agent fee dikenakan kepada pembeli.<br>* Urusan guaman disediakan.<br>* Semakan kelayakan pinjaman secara PERCUMA.<br><br>=====================<br>Asking Price: RM265,000 (Negotiable)<br>=====================<br><br>Interested please contact:<br>Call or Whatsapp<br>IZZAT<br>REN37483<br>REAL ESTATE NEGOTIATOR / <br>PERUNDING HARTANAH BERDAFTAR<br>ESP PROPERTIES / ELITE GROUP / TEAM LEADER<br><br>H/P: 019.706.7005<br>www.izzathartanah.com<br>Email: izzataiman.elite@gmail.com<br>Listing Mudah : https://www.mudah.my/izzat-aiman-ren37483-esp-properties-sdn-bhd<br><br>Kepada PEMILIK Hartanah yang ingin menjual hartanah (Rumah / Kedai / Tanah).<br>Kami sedia membantu anda dalam urusan:<br><br>(+) Perkhidmatan Jual Beli Hartanah<br>(+) Semakan Harga Terkini Pasaran / Check Market Value<br>(+) Urusan Permohonan Pinjaman<br>(+) Urusan Khidmat Guaman<br>(+) Khidmat Nasihat Jual Beli Hartanah (Prosedur dan Proses Penjualan / Pembelian)<br>*Tompel<br><br>Sila hubungi call / whatsapp di 019-706 7005.<br>Khdmat nasihat dan rundingan secara PERCUMA<br><br>Berurusanlah dengan EJEN HARTANAH BERDAFTAR, semestinya segala urusan TELUS dan mengikut garis panduan yang BETUL dan SELAMAT<br><br>AGENT HARTANAH ANDA,<br>EN. IZZAT <br>(REN37483)<br>019-706 7005<br>REAL ESTATE NEGOTIATOR / <br>PERUNDING HARTANAH BERDAFTAR",,,,Apartment / Condominium,265000.0,"RM 265,000",MYR,,johor,Skudai,Johor,"Jalan Silat Lincah, Bandar Selesa Jaya, 81300 Skudai, Johor",81300,,,For Sale,apartment,,920,,,4,2,,,,,,,,,,,,,,,,,,4.0,,,,,,,More on Villa Krystal @ Bandar Selesa Jaya,https://www.mudah.my/property/properties-in-villa-krystal-bandar-selesa-jaya-johor,ORANDO HOLDINGS SDN BHD,,,,"[""https://cdn.rnudah.com/images/plain/a53777b2532525cc914d273c6cfa5e30-2977490175293227188.jpg"", ""https://cdn.rnudah.com/images/plain/cfa4f64b66dfb76b7856999f08fa4466-2977490174722736308.jpg"", ""https://cdn.rnudah.com/images/plain/bcee4104c67c35e3fde03daf0cd5caec-2977490173662994672.jpg"", ""https://cdn.rnudah.com/images/plain/faf672e6e29ae7e630a58507e95cb3a1-2977490174018027700.jpg"", ""https://cdn.rnudah.com/images/plain/f603e25a70541427d9a384623fdda7d3-2977490172840845552.jpg""]",5,,,,,37483,"E - 10572, REN 37483 All ads from this advertiser (168 For Sale, 4 For Rent) Mortgage Estimation RM 1,056 Estimated monthly installment (Interest rate 4.0%) Property Price Loan Interest (%) Loan Amount Loan Tenure (Ye * This is for reference only and is not a quote. Results vary according to different financial institutions. Mudah.my doesn't guarantee it's accuracy or applicability to your circumstances. Is this your ad? Manage it using these links: Edit Delete Sold Bump Share This Ad Is this ad suspicious or inappropriate? Report this Ad ( List-ID: 114337230 ) Contact Agent IZZAT AIMAN REN37483 (online now) Property agent – Agent ID Checked ESP Properties Sdn Bhd Firm: E - 10572, REN 37483 All ads from this advertiser (168 For Sale, 4 For Rent) Mortgage Estimation RM 1,056 Estimated monthly installment (Interest rate 4.0%) Property Price Loan Interest (%) Loan Amount Loan Tenure (Ye * This is for reference only and is not a quote. Results vary according to different financial institutions. Mudah.my doesn't guarantee it's accuracy or applicability to your circumstances. Is this your ad? Manage it using these links: Edit Delete Sold Bump Share This Ad Is this ad suspicious or inappropriate? Report this Ad ( List-ID: 114337230 ) More picks below Back to Top",True,168,,,"Apartment for Sale, 4 Bedroom, 920 sq.ft, Villa Krystal @ Bandar Selesa Jaya, Skudai, Johor 114337230 | Mudah.my","Explore Apartment for Sale for RM 265,000 in Villa Krystal @ Bandar Selesa Jaya, Skudai, Johor. 920 sq.ft, 4 Bedroom, 2 Bathroom, Freehold, Parking, Security, Lift, Swimming Pool, Playground, Gymnasium, Barbeque area, Minimart, Club house, ID 114337230. Find your next property on Mudah.my.",https://cdn.rnudah.com/images/plain/a53777b2532525cc914d273c6cfa5e30-2977490175293227188.jpg,"Explore Apartment for Sale for RM 265,000 in Villa Krystal @ Bandar Selesa Jaya, Skudai, Johor. 920 sq.ft, 4 Bedroom, 2 Bathroom, Freehold, Parking, Security, Lift, Swimming Pool, Playground, Gymnasium, Barbeque area, Minimart, Club house, ID 114337230. Find your next property on Mudah.my.",mudah.my,2026-05-29T16:31:03.372213+00:00,
https://www.mudah.my/austin-perdana-mount-austin-corner-link-bungalow-for-sale-114862490.htm,https://www.mudah.my/austin-perdana-mount-austin-corner-link-bungalow-for-sale-114862490.htm,134900144,Austin Perdana @ Mount Austin (Corner Link bungalow For Sale),"FOR SALE <br>Austin Link Bungalow Corner (Semi-D Style) <br><br>📍 Jalan Austin Perdana, Mount Austin<br>Prime location in Mount Austin<br><br>Property Details:<br>2 Storey Corner Link Bungalow (Semi-D Concept)<br>* Freehold | Non-Bumi<br>* Corner Lot ✅<br>* Land Size: 4,154 sqf (61 x 70)<br>* Built-up: approx. 3,000 sqf<br>* 5+1 Bedrooms<br>* 5 Bathrooms<br>* Facing North<br>* Land Facing East (Morning sun )<br>* Gated & Guarded Community <br>* Wet kitchen and upstairs study area extended<br><br>Nearby Area:<br>Austin Heights • Taman Mount Austin • Taman Daya • Taman Setia Indah • Taman Molek • Johor Jaya • Desa Tebrau <br><br>💰 Asking Price: RM 1,900,000<br><br>🚫 No Co-broke Unit<br><br>---------------------<br><br>📢 Owners are welcome to list your property for sale or rent <br>📢 Serious buyers / tenants are welcome<br><br><br>Jordan Liew (REN46752)<br>📲010-7606886<br>📲PM / WhatsApp for viewing now<br>http://www.wasap.my/60107606886/Austin1.9mMc2284<br><br>#HouseJohorBahru<br>#JohorProperty<br>#RealEstateJohor<br>#FactoryShoplotForSale<br>#LandedHouseForSale<br>#ApartmentForSaleForRent<br>#新山房地产<br>#新山公寓出租出售<br>#装修双层排楼出售",,,,House,1900000.0,"RM 1,900,000",MYR,,johor,Tebrau,Johor,,11605,,,For Sale,bungalow,,4154,,,6,5,,,,,,,,,,,,,,,,,,4.0,,,,,,,,,,,,,"[""https://cdn.rnudah.com/images/plain/d98a4b3931b4d9629c9c570cce95fa79-2985998391345999141.jpg"", ""https://cdn.rnudah.com/images/plain/6a2f04694dded35d46b30957de2b0534-2985998390691622181.jpg"", ""https://cdn.rnudah.com/images/plain/1a74d72eb2c92e9531f210590231cebf-2985998390692801552.jpg"", ""https://cdn.rnudah.com/images/plain/a10b8882f071d3fefa926388df446699-2985998391347178512.jpg"", ""https://cdn.rnudah.com/images/plain/694167a9ea2a950a73acccc98fefae5c-2985998390189354000.jpg"", ""https://mcdn.mudah.my/static-assets/images/adview/freehold.svg"", ""https://mcdn.mudah.my/static-assets/images/adview/renovated.svg"", ""https://mcdn.mudah.my/static-assets/images/adview/border.svg"", ""https://mcdn.mudah.my/static-assets/images/adview/garden.svg"", ""https://mcdn.mudah.my/static-assets/images/adview/road.svg"", ""https://www.facebook.com/tr?id=632307416906311&ev=ViewContent&cd[content_type]=product&cd[content_ids]=114862490&cd[value]=1900000&cd[currency]=MYR&cd[content_category]=2000%20%7C%20properties&noscript=1""]",11,,,,,46752,"E - 11605, REN 46752 All ads from this advertiser (71 For Sale, 63 For Rent) Mortgage Estimation RM 7,571 Estimated monthly installment (Interest rate 4.0%) Property Price Loan Interest (%) Loan Amount Loan Tenure (Years) * This is for reference only and is not a quote. Results vary according to different financial institutions. Mudah.my doesn't guarantee it's accuracy or applicability to your circumstances. Is this your ad? Manage it using these links: Edit Delete Sold Bump Share This Ad Is this ad suspicious or inappropriate? Report this Ad ( List-ID: 114862490 ) Contact Agent WhatsApp Chat 010760**** Jordan Liew Property agent – Agent ID Checked The Roof Realty Sdn Bhd Firm: E - 11605, REN 46752 All ads from this advertiser (71 For Sale, 63 For Rent) Mortgage Estimation RM 7,571 Estimated monthly installment (Interest rate 4.0%) Property Price Loan Interest (%) Loan Amount Loan Tenure (Years) * This is for reference only and is not a quote. Results vary according to different financial institutions. Mudah.my doesn't guarantee it's accuracy or applicability to your circumstances. Is this your ad? Manage it using these links: Edit Delete Sold Bump Share This Ad Is this ad suspicious or inappropriate? Report this Ad ( List-ID: 114862490 ) More picks below Back to Top",True,71,,,"Link Bungalow for Sale, 6 Bedroom, 4154 sq.ft, Tebrau, Johor 114862490 | Mudah.my","Explore Link Bungalow for Sale for RM 1,900,000 Austin Perdana @ Mount Austin (Corner Link bungalow For Sale) in Tebrau, Johor. 4154 sq.ft, 6 Bedroom, 5 Bathroom, Freehold, Security, Playground, ID 114862490. Find your next property on Mudah.my.",https://cdn.rnudah.com/images/plain/d98a4b3931b4d9629c9c570cce95fa79-2985998391345999141.jpg,"Explore Link Bungalow for Sale for RM 1,900,000 Austin Perdana @ Mount Austin (Corner Link bungalow For Sale) in Tebrau, Johor. 4154 sq.ft, 6 Bedroom, 5 Bathroom, Freehold, Security, Playground, ID 114862490. Find your next property on Mudah.my.",mudah.my,2026-05-29T03:53:24.492527+00:00,
