listing_url,canonical_url,list_id,title,description,posted_at,ad_status,is_featured,category_name,price,price_display,currency,price_per_sqft,region,area,state,full_address,postcode,latitude,longitude,transaction_type,property_type,property_sub_type,size_sqft,land_area,land_area_unit,bedrooms,bathrooms,carpark,floor_range,total_floors_unit,furnishing,condition,facing_direction,unit_type,is_tenanted,tenure_type,remaining_tenure,land_title,strata_title,maintenance_fee,assessment_tax,deposit_months,utility_deposit_months,mortgage_estimate,mortgage_rate,facilities_list,nearby_bus_stops,nearby_schools,nearby_parks,nearby_hospitals,nearby_shopping,development_name,development_url,developer,completion_year,total_floors,total_units,image_urls,image_count,seller_name,seller_type,seller_profile_url,seller_logo_url,ren_number,firm_license,is_verified,total_ads,agent_phone,agent_whatsapp,og_title,og_description,og_image,meta_description,source,scraped_at,raw_attributes
https://www.mudah.my/full-loan-nusa-perdana-service-apartment-gelang-patah-114883154.htm,https://www.mudah.my/full-loan-nusa-perdana-service-apartment-gelang-patah-114883154.htm,134922981,Full Loan Nusa Perdana Service Apartment @ Gelang Patah,"FOR SALE<br><br>Nusa Perdana Service Apartment @ Gelang Patah<br>Built-up: 904 sqft <br>5th Floor <br>Bedrooms: 3<br>Bathrooms: 2<br>International <br>Non-Bumi<br>Intermediate<br>Partially Furnished<br>Carpark: 1<br>Gated & Guarded: Yes<br><br>** Selling Price: RM 318K<br>** Bank Value: RM 380K<br><br>*** Full Loan Available ***<br><br>For viewing or further details, please do not hesitate to contact or WhatsApp:<br>Mr Justin (REN 40417) at +6019-8885699<br><br>http://www.wasap.my/60198885699/NusaPerdana<br>http://www.wasap.my/60198885699/NusaPerdana<br><br>** Property Wanted, Owners are Welcome to contact me to list your property for Sell or Rent.<br>** 征求产业, 欢迎屋主委托我们帮您出售您的产业, 我们专业的团队将会在最快的时间内出售您的屋子.",,,,Apartment / Condominium,318000.0,"RM 318,000",MYR,,johor,Gelang Patah,Johor,"Jalan Nusa Perdana, Taman Nusa Perintis, 81550 Gelang Patah, Johor",40417,,,For Sale,apartment,,904,,,3,2,,,,,,,,,,,,,,,,,,4.0,,,,,,,More on Nusa Perdana Service Apartment,https://www.mudah.my/property/properties-in-nusa-perdana-service-apartment-johor,,,,,"[""https://cdn.rnudah.com/images/plain/41fb1125cabe4cc222cd79ca166c36e2-2986432892769458147.jpg"", ""https://cdn.rnudah.com/images/plain/4e1a2ab4d7871e08106954157d794fec-2986432892850000297.jpg"", ""https://cdn.rnudah.com/images/plain/129a7215b4fbb87794504a2ec485d8e7-2986432892480836009.jpg"", ""https://cdn.rnudah.com/images/plain/c7c1a39bff7597a578640eeaafc0a418-2986432892883620265.jpg"", ""https://cdn.rnudah.com/images/plain/4ce73da9b64076eb827e7d12e640c55b-2986432891024431075.jpg""]",5,,,,https://img.rnudah.com/stores/logo_921113_cwq.jpg,40417,"E - 11605, REN 40417 All ads from this advertiser (69 For Sale, 26 For Rent) Mortgage Estimation RM 1,267 Estimated monthly installment (Interest rate 4.0%) Property Price Loan Interest (%) Loan Amount Loan Tenure (Ye * This is for reference only and is not a quote. Results vary according to different financial institutions. Mudah.my doesn't guarantee it's accuracy or applicability to your circumstances. Is this your ad? Manage it using these links: Edit Delete Sold Bump Share This Ad Is this ad suspicious or inappropriate? Report this Ad ( List-ID: 114883154 ) Contact Agent Justin Kong Property agent – Agent ID Checked The Roof Realty Sdn bhd Firm: E - 11605, REN 40417 All ads from this advertiser (69 For Sale, 26 For Rent) Mortgage Estimation RM 1,267 Estimated monthly installment (Interest rate 4.0%) Property Price Loan Interest (%) Loan Amount Loan Tenure (Ye * This is for reference only and is not a quote. Results vary according to different financial institutions. Mudah.my doesn't guarantee it's accuracy or applicability to your circumstances. Is this your ad? Manage it using these links: Edit Delete Sold Bump Share This Ad Is this ad suspicious or inappropriate? Report this Ad ( List-ID: 114883154 ) More picks below Back to Top",True,69,,,"Service Residence for Sale, 3 Bedroom, 904 sq.ft, Nusa Perdana Service Apartment, Gelang Patah, Johor 114883154 | Mudah.my","Explore Service Residence for Sale for RM 318,000 in Nusa Perdana Service Apartment, Gelang Patah, Johor. 904 sq.ft, 3 Bedroom, 2 Bathroom, Freehold, Parking, Security, Lift, Swimming Pool, Playground, ID 114883154. Find your next property on Mudah.my.",https://cdn.rnudah.com/images/plain/41fb1125cabe4cc222cd79ca166c36e2-2986432892769458147.jpg,"Explore Service Residence for Sale for RM 318,000 in Nusa Perdana Service Apartment, Gelang Patah, Johor. 904 sq.ft, 3 Bedroom, 2 Bathroom, Freehold, Parking, Security, Lift, Swimming Pool, Playground, ID 114883154. Find your next property on Mudah.my.",mudah.my,2026-05-29T16:22:05.817143+00:00,
https://www.mudah.my/full-loan-one-sentral-serviced-residence-apartments-taman-bukit-indah-114877262.htm,https://www.mudah.my/full-loan-one-sentral-serviced-residence-apartments-taman-bukit-indah-114877262.htm,134917205,Full loan one sentral serviced residence apartments taman bukit indah,"For Sale <br><br>One Sentral Serviced Residence <br>Area: Nusa Sentral , Horizon Hill , Nusa Idaman , Nusa Indah <br>2 Bedroom 2 Bathroom <br>770 Sqft<br>Non Bumi Lot <br>Freehold <br>Maintenance Fees RM300<br>1 Parking Lot <br><br>Selling Price: RM 400K",,,,Apartment / Condominium,400000.0,"RM 400,000",MYR,,johor,Iskandar Puteri,Johor,"Jalan Sentral 1, Taman Nusa Sentral, 79100 Iskandar Puteri, Johor",79100,,,For Sale,apartment,,770,,,2,2,,,,,,,,,,,,,,,,,,4.0,,,,,,,More on One Sentral Serviced Residence,https://www.mudah.my/property/properties-in-one-sentral-serviced-residence-johor,COUNTRY VIEW BERHAD,,,,"[""https://cdn.rnudah.com/images/plain/631b27905ac07f99f0475055ab760870-2986370537150009769.jpg""]",1,,,,,23013,"E - 11605, REN 23013 All ads from this advertiser (245 For Sale) Mortgage Estimation RM 1,594 Estimated monthly installment (Interest rate 4.0%) Property Price Loan Interest (%) Loan Amount Loan Tenure (Ye * This is for reference only and is not a quote. Results vary according to different financial institutions. Mudah.my doesn't guarantee it's accuracy or applicability to your circumstances. Is this your ad? Manage it using these links: Edit Delete Sold Bump Share This Ad Is this ad suspicious or inappropriate? Report this Ad ( List-ID: 114877262 ) Contact Agent Betty Ng Property agent – Agent ID Checked The Roof Realty Sdn Bhd Firm: E - 11605, REN 23013 All ads from this advertiser (245 For Sale) Mortgage Estimation RM 1,594 Estimated monthly installment (Interest rate 4.0%) Property Price Loan Interest (%) Loan Amount Loan Tenure (Ye * This is for reference only and is not a quote. Results vary according to different financial institutions. Mudah.my doesn't guarantee it's accuracy or applicability to your circumstances. Is this your ad? Manage it using these links: Edit Delete Sold Bump Share This Ad Is this ad suspicious or inappropriate? Report this Ad ( List-ID: 114877262 ) More picks below Back to Top",True,245,,,"Service Residence for Sale, 2 Bedroom, 770 sq.ft, One Sentral Serviced Residence, Iskandar Puteri, Johor 114877262 | Mudah.my","Explore Service Residence for Sale for RM 400,000 in One Sentral Serviced Residence, Iskandar Puteri, Johor. 770 sq.ft, 2 Bedroom, 2 Bathroom, Freehold, Parking, Security, Swimming Pool, Gymnasium, Sauna, Minimart, ID 114877262. Find your next property on Mudah.my.",https://cdn.rnudah.com/images/plain/631b27905ac07f99f0475055ab760870-2986370537150009769.jpg,"Explore Service Residence for Sale for RM 400,000 in One Sentral Serviced Residence, Iskandar Puteri, Johor. 770 sq.ft, 2 Bedroom, 2 Bathroom, Freehold, Parking, Security, Swimming Pool, Gymnasium, Sauna, Minimart, ID 114877262. Find your next property on Mudah.my.",mudah.my,2026-05-29T03:13:27.215918+00:00,
https://www.mudah.my/full-loan-persiaran-tanjung-apartment-renovated-tampoi-johor-114705515.htm,https://www.mudah.my/full-loan-persiaran-tanjung-apartment-renovated-tampoi-johor-114705515.htm,134723274,FULL LOAN Persiaran Tanjung Apartment Renovated Tampoi Johor,"Persiaran Tanjung Apartment<br><br>Blok C<br>Mid Floor<br>3 Bed 2 Bath<br>950 Sqft<br>Leasehold<br>Non Bumi Lot<br><br>Selling Price 288k<br>Use Owner Lawyer<br><br>For more information, please contact:<br>Jack – 011-1088 8283<br>https://wasap.my/601110888283",,,,Apartment / Condominium,288000.0,"RM 288,000",MYR,,johor,Tampoi,Johor,"Jalan Persiaran Tanjung, Taman Bukit Alif, 81200 Tampoi, Johor",81200,,,For Sale,apartment,,950,,,3,2,,,,,,,,,,,,,,,,,,4.0,,,,,,,More on Persiaran Tanjung Apartment,https://www.mudah.my/property/properties-in-persiaran-tanjung-apartment-johor,,,,,"[""https://cdn.rnudah.com/images/plain/0d82c2f213a1583c8228fcbc67515b78-2983379779211331608.jpg""]",1,,,,,,,True,144,,,"Apartment for Sale, 3 Bedroom, 950 sq.ft, Persiaran Tanjung Apartment, Tampoi, Johor 114705515 | Mudah.my","Explore Apartment for Sale for RM 288,000 in Persiaran Tanjung Apartment, Tampoi, Johor. 950 sq.ft, 3 Bedroom, 2 Bathroom, Leasehold, Parking, Security, Lift, Swimming Pool, Playground, Gymnasium, Barbeque area, Minimart, Jogging Track, Tennis Court, ID 114705515. Find your next property on Mudah.my.",https://cdn.rnudah.com/images/plain/0d82c2f213a1583c8228fcbc67515b78-2983379779211331608.jpg,"Explore Apartment for Sale for RM 288,000 in Persiaran Tanjung Apartment, Tampoi, Johor. 950 sq.ft, 3 Bedroom, 2 Bathroom, Leasehold, Parking, Security, Lift, Swimming Pool, Playground, Gymnasium, Barbeque area, Minimart, Jogging Track, Tennis Court, ID 114705515. Find your next property on Mudah.my.",mudah.my,2026-05-29T03:13:26.494888+00:00,
https://www.mudah.my/full-loan-polo-marina-park-apartment-at-johor-bahru-johor-114218363.htm,https://www.mudah.my/full-loan-polo-marina-park-apartment-at-johor-bahru-johor-114218363.htm,134178944,"Full Loan Polo Marina Park Apartment at Johor Bahru, Johor",For Sale  <br>Full Loan for 1st House <br>Polo Marina Park Apartment at Johor Bahru  1980sqft <br>Big sqft  <br>Bed 3+ 1 <br>Bath 2 <br>Good condition  <br>Just 5mins to Midvalley Southkey  <br>10mins to CIQ <br>Very strategic location<br>Currently tenanted and contract is ending soon.  <br><br>*Asking RM480k only*<br><br>Please contact Regina Khor 0162977057,,,,Apartment / Condominium,480000.0,"RM 480,000",MYR,,johor,Johor Bahru,Johor,"Jalan Bentara Luar 1, 80050 Johor Bahru, Johor",80050,,,For Sale,apartment,,1980,,,3,2,,,,,,,,,,,,,,,,,,4.0,,,,,,,More on Polo Park,https://www.mudah.my/property/properties-in-polo-park-johor,,,,,"[""https://cdn.rnudah.com/images/plain/777f4ac9cfc447c2fae0e23e51257759-2975050043269443588.jpg""]",1,,,,,22075,"E - 11605, REN 22075 All ads from this advertiser (30 For Sale, 13 For Rent) Mortgage Estimation RM 1,913 Estimated monthly installment (Interest rate 4.0%) Property Price Loan Interest (%) Loan Amount Loan Tenure (Ye * This is for reference only and is not a quote. Results vary according to different financial institutions. Mudah.my doesn't guarantee it's accuracy or applicability to your circumstances. Is this your ad? Manage it using these links: Edit Delete Sold Bump Share This Ad Is this ad suspicious or inappropriate? Report this Ad ( List-ID: 114218363 ) Contact Agent Regina Khor Wei Wei Property agent – Agent ID Checked The Roof Realty Sdn Bhd Firm: E - 11605, REN 22075 All ads from this advertiser (30 For Sale, 13 For Rent) Mortgage Estimation RM 1,913 Estimated monthly installment (Interest rate 4.0%) Property Price Loan Interest (%) Loan Amount Loan Tenure (Ye * This is for reference only and is not a quote. Results vary according to different financial institutions. Mudah.my doesn't guarantee it's accuracy or applicability to your circumstances. Is this your ad? Manage it using these links: Edit Delete Sold Bump Share This Ad Is this ad suspicious or inappropriate? Report this Ad ( List-ID: 114218363 ) More picks below Back to Top",True,30,,,"Apartment for Sale, 3 Bedroom, 1980 sq.ft, Polo Park, Johor Bahru, Johor 114218363 | Mudah.my","Explore Apartment for Sale for RM 480,000 in Polo Park, Johor Bahru, Johor. 1980 sq.ft, 3 Bedroom, 2 Bathroom, Freehold, Parking, Security, Lift, Swimming Pool, ID 114218363. Find your next property on Mudah.my.",https://cdn.rnudah.com/images/plain/777f4ac9cfc447c2fae0e23e51257759-2975050043269443588.jpg,"Explore Apartment for Sale for RM 480,000 in Polo Park, Johor Bahru, Johor. 1980 sq.ft, 3 Bedroom, 2 Bathroom, Freehold, Parking, Security, Lift, Swimming Pool, ID 114218363. Find your next property on Mudah.my.",mudah.my,2026-05-29T03:13:27.396915+00:00,
https://www.mudah.my/full-loan-ria-2-medium-cost-apartment-taman-megah-ria-masai-114882952.htm,https://www.mudah.my/full-loan-ria-2-medium-cost-apartment-taman-megah-ria-masai-114882952.htm,134922828,"Full Loan Ria 2 Medium Cost Apartment, Taman Megah Ria, Masai","FOR SALE<br><br>Ria Apartment 2, Jalan Cenderai 19, Taman Megah Ria, 81750 Masai, Johor Darul Ta'zim.<br>- Medium Cost Apartment<br>- ⁠Blok R, Level 3<br>- Built Up Size: 807 sqft<br>- ⁠3 Bedrooms <br>- 2 Bathrooms<br>- Freehold<br>- International lot<br>- ⁠New painting, fully tiles<br>- ⁠Facilities including swimming pool <br>- Maintenance fee RM165+<br>- Gated & Guarded: Yes<br><br>** Selling Price: RM 200K<br>** Bank Value: RM 240K<br><br>*** Full Loan Available ***<br><br>For viewing or further details, please do not hesitate to contact or WhatsApp:<br>Mr Justin (REN 40417) at +6019-8885699<br><br>http://www.wasap.my/60198885699/Ria2<br>http://www.wasap.my/60198885699/Ria2<br><br>** Property Wanted, Owners are Welcome to contact me to list your property for Sell or Rent.<br>** 征求产业, 欢迎屋主委托我们帮您出售您的产业, 我们专业的团队将会在最快的时间内出售您的屋子.",,,,Apartment / Condominium,200000.0,"RM 200,000",MYR,,johor,Masai,Johor,"Full Loan Ria 2 Medium Cost Apartment, Taman Megah Ria, Masai",81750,,,For Sale,apartment,,807,,,3,2,,,,,,,,,,,,,,,,,,4.0,,,,,,,More on Ria 2 Apartment,https://www.mudah.my/property/properties-in-ria-2-apartment-johor,,,,,"[""https://cdn.rnudah.com/images/plain/b529fb0f816a9cd199c9034db5e5849c-2986430688728111075.jpg"", ""https://cdn.rnudah.com/images/plain/f1229e9c56a23a17694b49c02eb192f8-2986430689365841891.jpg"", ""https://cdn.rnudah.com/images/plain/77fefc36f23643bf179e4f407b9e2785-2986430689008538025.jpg"", ""https://cdn.rnudah.com/images/plain/c67eb0246a5b2e5c8a8ac2bc6d22d412-2986430689248335843.jpg"", ""https://cdn.rnudah.com/images/plain/fc457b9e01c805cffdd5e8f54f81941a-2986430689417160074.jpg""]",5,,,,https://img.rnudah.com/stores/logo_921113_cwq.jpg,40417,"E - 11605, REN 40417 All ads from this advertiser (69 For Sale, 26 For Rent) Mortgage Estimation RM 797 Estimated monthly installment (Interest rate 4.0%) Property Price Loan Interest (%) Loan Amount Loan Tenure (Ye * This is for reference only and is not a quote. Results vary according to different financial institutions. Mudah.my doesn't guarantee it's accuracy or applicability to your circumstances. Is this your ad? Manage it using these links: Edit Delete Sold Bump Share This Ad Is this ad suspicious or inappropriate? Report this Ad ( List-ID: 114882952 ) Contact Agent Justin Kong Property agent – Agent ID Checked The Roof Realty Sdn bhd Firm: E - 11605, REN 40417 All ads from this advertiser (69 For Sale, 26 For Rent) Mortgage Estimation RM 797 Estimated monthly installment (Interest rate 4.0%) Property Price Loan Interest (%) Loan Amount Loan Tenure (Ye * This is for reference only and is not a quote. Results vary according to different financial institutions. Mudah.my doesn't guarantee it's accuracy or applicability to your circumstances. Is this your ad? Manage it using these links: Edit Delete Sold Bump Share This Ad Is this ad suspicious or inappropriate? Report this Ad ( List-ID: 114882952 ) More picks below Back to Top",True,69,,,"Apartment for Sale, 3 Bedroom, 807 sq.ft, Ria 2 Apartment, Masai, Johor 114882952 | Mudah.my","Explore Apartment for Sale for RM 200,000 in Ria 2 Apartment, Masai, Johor. 807 sq.ft, 3 Bedroom, 2 Bathroom, Freehold, Parking, Security, Swimming Pool, Playground, ID 114882952. Find your next property on Mudah.my.",https://cdn.rnudah.com/images/plain/b529fb0f816a9cd199c9034db5e5849c-2986430688728111075.jpg,"Explore Apartment for Sale for RM 200,000 in Ria 2 Apartment, Masai, Johor. 807 sq.ft, 3 Bedroom, 2 Bathroom, Freehold, Parking, Security, Swimming Pool, Playground, ID 114882952. Find your next property on Mudah.my.",mudah.my,2026-05-29T16:21:55.883754+00:00,
https://www.mudah.my/full-loan-sri-akasia-apartment-tampoi-indah-renovated-114256377.htm,https://www.mudah.my/full-loan-sri-akasia-apartment-tampoi-indah-renovated-114256377.htm,134220000,"Full Loan Sri Akasia Apartment Tampoi Indah, Renovated","FOR SALE<br><br>Sri Akasia Apartment @ Tampoi Indah<br>- Landsize: 1028 sqft<br>- Bedrooms:  3 <br>- Bathrooms: 2<br>- Leasehold<br>- Non Bumi Lot<br>- 1 Car Park<br>- ⁠Maintenance fee Rm 200/mth<br>- Gated & Guarded: Yes<br>- Fully Renovated with kitchen cabinet & table top, fully plaster ceiling, build in wardrobe <br><br>** Selling Price: RM 368K<br>** Bank Value: RM 430K<br><br>*** Full Loan Available ***<br><br>For viewing or further details, please do not hesitate to contact or WhatsApp:<br>Mr Justin (REN 40417) at +6019-8885699<br><br>http://www.wasap.my/60198885699/SriAkasia<br>http://www.wasap.my/60198885699/SriAkasia<br><br>** Property Wanted, Owners are Welcome to contact me to list your property for Sell or Rent.<br>** 征求产业, 欢迎屋主委托我们帮您出售您的产业, 我们专业的团队将会在最快的时间内出售您的屋子.",,,,Apartment / Condominium,368000.0,"RM 368,000",MYR,,johor,Johor Bahru,Johor,"Jalan Titiwangsa Utama, Taman Tampoi Indah, 81200 Johor Bahru, Johor",40417,,,For Sale,apartment,,1028,,,3,2,,,,,,,,,,,,,,,,,,4.0,,,,,,,More on Sri Akasia,https://www.mudah.my/property/properties-in-sri-akasia-johor,KIP GROUP OF COMPANIES,,,,"[""https://cdn.rnudah.com/images/plain/7ae9d170bebdcb9c71e066f28006a899-2975701658395370915.jpg"", ""https://cdn.rnudah.com/images/plain/5d761439c63fd4ed80aeb721ad337cb6-2975701658057000702.jpg"", ""https://cdn.rnudah.com/images/plain/2b3f2baa60d966c45fed97745751e9ff-2975701656955777028.jpg"", ""https://cdn.rnudah.com/images/plain/ebef1aec05ec6d3b1cbac19e49bc0869-2975701658233618171.jpg"", ""https://cdn.rnudah.com/images/plain/30be7cf3691078fccb91f466ef5d9b21-2975701657740993955.jpg""]",5,,,,https://img.rnudah.com/stores/logo_921113_cwq.jpg,40417,"E - 11605, REN 40417 All ads from this advertiser (69 For Sale, 26 For Rent) Mortgage Estimation RM 1,466 Estimated monthly installment (Interest rate 4.0%) Property Price Loan Interest (%) Loan Amount Loan Tenure (Ye * This is for reference only and is not a quote. Results vary according to different financial institutions. Mudah.my doesn't guarantee it's accuracy or applicability to your circumstances. Is this your ad? Manage it using these links: Edit Delete Sold Bump Share This Ad Is this ad suspicious or inappropriate? Report this Ad ( List-ID: 114256377 ) Contact Agent Justin Kong Property agent – Agent ID Checked The Roof Realty Sdn bhd Firm: E - 11605, REN 40417 All ads from this advertiser (69 For Sale, 26 For Rent) Mortgage Estimation RM 1,466 Estimated monthly installment (Interest rate 4.0%) Property Price Loan Interest (%) Loan Amount Loan Tenure (Ye * This is for reference only and is not a quote. Results vary according to different financial institutions. Mudah.my doesn't guarantee it's accuracy or applicability to your circumstances. Is this your ad? Manage it using these links: Edit Delete Sold Bump Share This Ad Is this ad suspicious or inappropriate? Report this Ad ( List-ID: 114256377 ) More picks below Back to Top",True,69,,,"Apartment for Sale, 3 Bedroom, 1028 sq.ft, Sri Akasia, Johor Bahru, Johor 114256377 | Mudah.my","Explore Apartment for Sale for RM 368,000 in Sri Akasia, Johor Bahru, Johor. 1028 sq.ft, 3 Bedroom, 2 Bathroom, Leasehold, Parking, Security, Lift, Swimming Pool, Playground, Gymnasium, Sauna, Barbeque area, Minimart, Club house, Jogging Track, ID 114256377. Find your next property on Mudah.my.",https://cdn.rnudah.com/images/plain/7ae9d170bebdcb9c71e066f28006a899-2975701658395370915.jpg,"Explore Apartment for Sale for RM 368,000 in Sri Akasia, Johor Bahru, Johor. 1028 sq.ft, 3 Bedroom, 2 Bathroom, Leasehold, Parking, Security, Lift, Swimming Pool, Playground, Gymnasium, Sauna, Barbeque area, Minimart, Club house, Jogging Track, ID 114256377. Find your next property on Mudah.my.",mudah.my,2026-05-29T16:22:07.586161+00:00,
https://www.mudah.my/full-loan-taman-d-utama-townhouse-bukit-indah-perling-nusa-bestari-114807328.htm,https://www.mudah.my/full-loan-taman-d-utama-townhouse-bukit-indah-perling-nusa-bestari-114807328.htm,134838957,Full loan taman d utama townhouse bukit indah perling nusa bestari,"For Sales<br><br>Pangsapuri Ria, Taman D Utama<br><br>Near Perling, Bukit indah <br><br>Townhouse <br>3th floor Corner<br>1147sqft<br>3 Bedrooms<br>2 Bathrooms <br>Freehold & non Bumi<br>Direction south<br>1 carpark<br>G&G(RM300+- mth)<br>Tenanted<br>Strata title<br><br>Selling Price RM 370k",,,,House,370000.0,"RM 370,000",MYR,,johor,Johor Bahru,Johor,,11605,,,For Sale,townhouse,,1147,,,3,2,,,,,,,,,,,,,,,,,,4.0,,,,,,,,,,,,,"[""https://cdn.rnudah.com/images/plain/fa745fe5aff6efc97f75a43615b10c5d-2985059146726205505.jpg"", ""https://cdn.rnudah.com/images/plain/8db9ea17e406dc295eb918db514efceb-2985059147135736269.jpg"", ""https://cdn.rnudah.com/images/plain/2752da04d78febc98fba4300c15af3ca-2985059148034893889.jpg"", ""https://cdn.rnudah.com/images/plain/e5e48796cc2889c3cb1fc78abf460e38-2985059150551541825.jpg"", ""https://cdn.rnudah.com/images/plain/68d764e21003ff7f881a7f2375702a22-2985059151699270093.jpg"", ""https://mcdn.mudah.my/static-assets/images/adview/freehold.svg"", ""https://mcdn.mudah.my/static-assets/images/adview/gooddeal.svg"", ""https://mcdn.mudah.my/static-assets/images/adview/border.svg"", ""https://mcdn.mudah.my/static-assets/images/adview/garden.svg"", ""https://www.facebook.com/tr?id=632307416906311&ev=ViewContent&cd[content_type]=product&cd[content_ids]=114807328&cd[value]=370000&cd[currency]=MYR&cd[content_category]=2000%20%7C%20properties&noscript=1""]",10,,,,,23013,"E - 11605, REN 23013 All ads from this advertiser (256 For Sale) Mortgage Estimation RM 1,474 Estimated monthly installment (Interest rate 4.0%) Property Price Loan Interest (%) Loan Amount Loan Tenure (Years) * This is for reference only and is not a quote. Results vary according to different financial institutions. Mudah.my doesn't guarantee it's accuracy or applicability to your circumstances. Is this your ad? Manage it using these links: Edit Delete Sold Bump Share This Ad Is this ad suspicious or inappropriate? Report this Ad ( List-ID: 114807328 ) Contact Agent 012756**** Betty Ng Property agent – Agent ID Checked The Roof Realty Sdn Bhd Firm: E - 11605, REN 23013 All ads from this advertiser (256 For Sale) Mortgage Estimation RM 1,474 Estimated monthly installment (Interest rate 4.0%) Property Price Loan Interest (%) Loan Amount Loan Tenure (Years) * This is for reference only and is not a quote. Results vary according to different financial institutions. Mudah.my doesn't guarantee it's accuracy or applicability to your circumstances. Is this your ad? Manage it using these links: Edit Delete Sold Bump Share This Ad Is this ad suspicious or inappropriate? Report this Ad ( List-ID: 114807328 ) More picks below Back to Top",True,256,,,"Townhouse for Sale, 3 Bedroom, 1147 sq.ft, Johor Bahru, Johor 114807328 | Mudah.my","Explore Townhouse for Sale for RM 370,000 Full loan taman d utama townhouse bukit indah perling nusa bestari in Johor Bahru, Johor. 1147 sq.ft, 3 Bedroom, 2 Bathroom, Freehold, Parking, Security, ID 114807328. Find your next property on Mudah.my.",https://cdn.rnudah.com/images/plain/fa745fe5aff6efc97f75a43615b10c5d-2985059146726205505.jpg,"Explore Townhouse for Sale for RM 370,000 Full loan taman d utama townhouse bukit indah perling nusa bestari in Johor Bahru, Johor. 1147 sq.ft, 3 Bedroom, 2 Bathroom, Freehold, Parking, Security, ID 114807328. Find your next property on Mudah.my.",mudah.my,2026-05-29T18:16:48.421646+00:00,
