listing_url,canonical_url,list_id,title,description,posted_at,ad_status,is_featured,category_name,price,price_display,currency,price_per_sqft,region,area,state,full_address,postcode,latitude,longitude,transaction_type,property_type,property_sub_type,size_sqft,land_area,land_area_unit,bedrooms,bathrooms,carpark,floor_range,total_floors_unit,furnishing,condition,facing_direction,unit_type,is_tenanted,tenure_type,remaining_tenure,land_title,strata_title,maintenance_fee,assessment_tax,deposit_months,utility_deposit_months,mortgage_estimate,mortgage_rate,facilities_list,nearby_bus_stops,nearby_schools,nearby_parks,nearby_hospitals,nearby_shopping,development_name,development_url,developer,completion_year,total_floors,total_units,image_urls,image_count,seller_name,seller_type,seller_profile_url,seller_logo_url,ren_number,firm_license,is_verified,total_ads,agent_phone,agent_whatsapp,og_title,og_description,og_image,meta_description,source,scraped_at,raw_attributes
https://www.mudah.my/masai-taman-megah-ria-jalan-bayan-double-storey-terrace-house-114825201.htm,https://www.mudah.my/masai-taman-megah-ria-jalan-bayan-double-storey-terrace-house-114825201.htm,134858395,Masai Taman Megah Ria Jalan Bayan Double Storey Terrace House,🐎🥰🐎 *MASAI TAMAN MEGAH RIA JALAN BAYAN DOUBLE STOREY TERRACE HOUSE* <br><br>😘 * Jalan Bayan Taman Megah Ria 81750 Masai Double Storey Terrace House*<br><br>✔️3 Bedrooms 1 Bathrooms<br>✔️ Freehold<br>✔️ Land Area: 770sqft<br>✔️ Nom Bumi Lot <br>✔️Individual Title <br><br>🤩 *SELLING PRICE RM398K*<br>🤩 *MARKET VALUE TBC*<br><br> we sale property below bank value to help buyers less cash out or without the 10% deposit ... call or whatssap us for free property Consultation <br><br>CALL OR WTZP<br>0164302461 JB Max,,,,House,398000.0,"RM 398,000",MYR,,johor,Masai,Johor,Masai Taman Megah Ria Jalan Bayan Double Storey Terrace House,81750,,,For Sale,double-storey,,770,,,3,1,,,,,,,,,,,,,,,,,,4.0,,,,,,,,,,,,,"[""https://cdn.rnudah.com/images/plain/7c0de731cfa7882e9600cb2e2aaef7c4-2985294224268782885.jpg"", ""https://cdn.rnudah.com/images/plain/b5ea988d482e0d46383a6f17dac5f474-2985294224501107728.jpg"", ""https://cdn.rnudah.com/images/plain/73770d58bcc43fd5294cfc1c488517be-2985294224788942117.jpg"", ""https://cdn.rnudah.com/images/plain/cd36b94e68c2e66683fc17fc052dc743-2985294225527205157.jpg"", ""https://cdn.rnudah.com/images/plain/0aa1107d86dc9e3c998219b47b27bf59-2985294226027965456.jpg"", ""https://mcdn.mudah.my/static-assets/images/adview/freehold.svg"", ""https://mcdn.mudah.my/static-assets/images/adview/gooddeal.svg"", ""https://mcdn.mudah.my/static-assets/images/adview/return.svg"", ""https://www.facebook.com/tr?id=632307416906311&ev=ViewContent&cd[content_type]=product&cd[content_ids]=114825201&cd[value]=398000&cd[currency]=MYR&cd[content_category]=2000%20%7C%20properties&noscript=1""]",9,,,,,30599,"E - 11934, REN 30599 All ads from this advertiser (431 For Sale, 1 For Rent) Mortgage Estimation RM 1,586 Estimated monthly installment (Interest rate 4.0%) Property Price Loan Interest (%) Loan Amount Loan Tenure (Years) * This is for reference only and is not a quote. Results vary according to different financial institutions. Mudah.my doesn't guarantee it's accuracy or applicability to your circumstances. Is this your ad? Manage it using these links: Edit Delete Sold Bump Share This Ad Is this ad suspicious or inappropriate? Report this Ad ( List-ID: 114825201 ) Contact Agent WhatsApp Chat 016430**** JB Max Property agent – Agent ID Checked Royce Properties Firm: E - 11934, REN 30599 All ads from this advertiser (431 For Sale, 1 For Rent) Mortgage Estimation RM 1,586 Estimated monthly installment (Interest rate 4.0%) Property Price Loan Interest (%) Loan Amount Loan Tenure (Years) * This is for reference only and is not a quote. Results vary according to different financial institutions. Mudah.my doesn't guarantee it's accuracy or applicability to your circumstances. Is this your ad? Manage it using these links: Edit Delete Sold Bump Share This Ad Is this ad suspicious or inappropriate? Report this Ad ( List-ID: 114825201 ) More picks below Back to Top",True,431,,,"2-storey Terraced House for Sale, 3 Bedroom, 770 sq.ft, Masai, Johor 114825201 | Mudah.my","Explore 2-storey Terraced House for Sale for RM 398,000 Masai Taman Megah Ria Jalan Bayan Double Storey Terrace House in Masai, Johor. 770 sq.ft, 3 Bedroom, 1 Bathroom, Freehold, ID 114825201. Find your next property on Mudah.my.",https://cdn.rnudah.com/images/plain/7c0de731cfa7882e9600cb2e2aaef7c4-2985294224268782885.jpg,"Explore 2-storey Terraced House for Sale for RM 398,000 Masai Taman Megah Ria Jalan Bayan Double Storey Terrace House in Masai, Johor. 770 sq.ft, 3 Bedroom, 1 Bathroom, Freehold, ID 114825201. Find your next property on Mudah.my.",mudah.my,2026-05-29T17:15:40.161046+00:00,
https://www.mudah.my/meridian-bayvue-non-bumi-apartment-sierra-perdana-masai-for-sale-108737077.htm,https://www.mudah.my/meridian-bayvue-non-bumi-apartment-sierra-perdana-masai-for-sale-108737077.htm,128098005,MERIDIAN BAYVUE NON BUMI APARTMENT SIERRA PERDANA MASAI - For Sale,"Meridin Bayvue Apartment, Sierra Perdana<br><br>Address : Block B1, Meridin Bayvue Apartment, Taman Sierra Perdana,<br> 81750 Masai<br>Bedroom : 3<br>Bathroom : 2<br>Type : Service Apartment<br>Unit type : Intermediate<br>Tenure : Freehold & Non Bumi<br>Built up : 980 sqft<br>Furnishing : partial furnished & like new unit<br>G&G :yes<br>Car park : 1<br>Negotiable<br>100% loan <br>No agent fee<br>Perfection title done<br><br>- Maintenance RM280 (includes sinking fund)<br>- Partial furnished<br>- Extended yard/kitchen<br>- Kitchen cabinet<br>- Fans & light<br>- Water heater<br>- Air conds<br><br>Nearby Amenities:<br>-Shopping: AEON Mall Permas Jaya (8 km), <br>- IKEA Tebrau (10 km), Toppen Shopping Centre (10 km)<br>- Education: Sunway College Johor Bahru (10 km), Real Schools Johor Bahru (8 km), Excelsior International School (12 km)<br>-Healthcare: Regency Specialist Hospital (15 km), Columbia Asia Hospital – Iskandar Puteri (25 km)<br>- 10 min to Woodland Check Point<br><br>📞Hubungi Roslina ;<br>H/P: 0127123266<br><br>ESP Properties Sdn. Bhd.<br>Call untuk viewing rumah dan periksa loan kelayakan secara PERCUMA. Kami juga menyediakan khidmat guaman dan khidmat pinjaman loan.",,,,Apartment / Condominium,380000.0,"RM 380,000",MYR,,johor,Masai,Johor,"Off JB East Coast Pkwy, Taman Sierra Perdana, 81750 Masai, Johor",81750,,,For Sale,apartment,,980,,,3,2,,,,,,,,,,,,,,,,,,4.0,,,,,,,More on Meridin Bayvue,https://www.mudah.my/property/properties-in-meridin-bayvue-johor,MAH SING GROUP BERHAD,,,,"[""https://cdn.rnudah.com/images/plain/403c4d75c47253db775273120e7430ba-2901368870049587685.jpg""]",1,,,,,61109,"E - 10572, REN 61109 All ads from this advertiser (19 For Sale, 1 For Rent) Mortgage Estimation RM 1,514 Estimated monthly installment (Interest rate 4.0%) Property Price Loan Interest (%) Loan Amount Loan Tenure (Ye * This is for reference only and is not a quote. Results vary according to different financial institutions. Mudah.my doesn't guarantee it's accuracy or applicability to your circumstances. Is this your ad? Manage it using these links: Edit Delete Sold Bump Share This Ad Is this ad suspicious or inappropriate? Report this Ad ( List-ID: 108737077 ) Contact Agent Roslina Property agent Elite Top Reality Firm: E - 10572, REN 61109 All ads from this advertiser (19 For Sale, 1 For Rent) Mortgage Estimation RM 1,514 Estimated monthly installment (Interest rate 4.0%) Property Price Loan Interest (%) Loan Amount Loan Tenure (Ye * This is for reference only and is not a quote. Results vary according to different financial institutions. Mudah.my doesn't guarantee it's accuracy or applicability to your circumstances. Is this your ad? Manage it using these links: Edit Delete Sold Bump Share This Ad Is this ad suspicious or inappropriate? Report this Ad ( List-ID: 108737077 ) More picks below Back to Top",,19,,,"Service Residence for Sale, 3 Bedroom, 980 sq.ft, Meridin Bayvue, Masai, Johor 108737077 | Mudah.my","Explore Service Residence for Sale for RM 380,000 in Meridin Bayvue, Masai, Johor. 980 sq.ft, 3 Bedroom, 2 Bathroom, Freehold, Parking, Security, Lift, Swimming Pool, Playground, Gymnasium, Barbeque area, Multipurpose hall, Club house, Jogging Track, Tennis Court, ID 108737077. Find your next property on Mudah.my.",https://cdn.rnudah.com/images/plain/403c4d75c47253db775273120e7430ba-2901368870049587685.jpg,"Explore Service Residence for Sale for RM 380,000 in Meridin Bayvue, Masai, Johor. 980 sq.ft, 3 Bedroom, 2 Bathroom, Freehold, Parking, Security, Lift, Swimming Pool, Playground, Gymnasium, Barbeque area, Multipurpose hall, Club house, Jogging Track, Tennis Court, ID 108737077. Find your next property on Mudah.my.",mudah.my,2026-05-29T16:13:46.918056+00:00,
https://www.mudah.my/non-bumi-jalan-khalidi-9-122-sqft-land-with-bungalow-114200767.htm,https://www.mudah.my/non-bumi-jalan-khalidi-9-122-sqft-land-with-bungalow-114200767.htm,134156480,"(NON BUMI!!) Jalan Khalidi 9,122 Sqft Land With Bungalow","CHEAPEST IN JALAN KHALIDI WITH BIGGER SIZE!!<br><br>For Sale : (NON BUMI!!) Jalan Khalidi 9,122 Sqft Land With Bungalow Muar Johor<br><br>============================<br>Asking Price : RM 1,900,000 Only!!<br>============================<br><br>DETAILS : <br>- Freehold International Lot <br>- Size : 9,122 Sqft<br>- 6 Bedroom<br>- 7 Bathroom <br>- Swimming Pool <br><br>NEARBY : <br>- Walking Distance to Muar Art Cafe Gallery<br>- Walking Distance to Asam Pedas Jalan Junid <br>- Walking Distance to Tadika Krista (Beside House) <br>- Near to Bandar Muar <br>- Near to Tanjung<br><br>============================<br>Asking Price : RM 1,900,000 Only!!<br>============================<br><br>ALIF RAZAK<br>013-6899006 (Call/SMS/Whatsapp)<br>REN 27127<br>IQI REALTY SDN BHD",,,,House,1900000.0,"RM 1,900,000",MYR,,johor,Muar,Johor,"(NON BUMI!!) Jalan Khalidi 9,122 Sqft Land With Bungalow",27127,,,For Sale,bungalow,,9122,,,6,7,,,,,,,,,,,,,,,,,,4.0,,,,,,,,,,,,,"[""https://cdn.rnudah.com/images/plain/71bc091f3f7638897831f7e863e8a066-2974753352647512175.jpg"", ""https://cdn.rnudah.com/images/plain/efc5527dce07b7d828cf77860140f684-2974753349291872367.jpg"", ""https://cdn.rnudah.com/images/plain/1a19cc96a5e172e6244de0e119014a6a-2974753344763158482.jpg"", ""https://cdn.rnudah.com/images/plain/16f695951aba776e9801e5e804a3d29b-2974753344342528111.jpg"", ""https://cdn.rnudah.com/images/plain/71a5d26114cb4f4e76e7f50564add820-2974753351976648402.jpg""]",5,,,,,27127,"VE - 30244, REN 27127 All ads from this advertiser (26 For Sale) Mortgage Estimation RM 7,571 Estimated monthly installment (Interest rate 4.0%) Property Price Loan Interest (%) Loan Amount Loan Tenure (Ye * This is for reference only and is not a quote. Results vary according to different financial institutions. Mudah.my doesn't guarantee it's accuracy or applicability to your circumstances. Is this your ad? Manage it using these links: Edit Delete Sold Bump Share This Ad Is this ad suspicious or inappropriate? Report this Ad ( List-ID: 114200767 ) Contact Agent ALIF RAZAK Property agent IQI REALTY SDN BHD Firm: VE - 30244, REN 27127 All ads from this advertiser (26 For Sale) Mortgage Estimation RM 7,571 Estimated monthly installment (Interest rate 4.0%) Property Price Loan Interest (%) Loan Amount Loan Tenure (Ye * This is for reference only and is not a quote. Results vary according to different financial institutions. Mudah.my doesn't guarantee it's accuracy or applicability to your circumstances. Is this your ad? Manage it using these links: Edit Delete Sold Bump Share This Ad Is this ad suspicious or inappropriate? Report this Ad ( List-ID: 114200767 ) More picks below Back to Top",,26,,,"Bungalow House for Sale, 6 Bedroom, 9122 sq.ft, Muar, Johor 114200767 | Mudah.my","Explore Bungalow House for Sale for RM 1,900,000 (NON BUMI!!) Jalan Khalidi 9,122 Sqft Land With Bungalow in Muar, Johor. 9122 sq.ft, 6 Bedroom, 7 Bathroom, Freehold, ID 114200767. Find your next property on Mudah.my.",https://cdn.rnudah.com/images/plain/71bc091f3f7638897831f7e863e8a066-2974753352647512175.jpg,"Explore Bungalow House for Sale for RM 1,900,000 (NON BUMI!!) Jalan Khalidi 9,122 Sqft Land With Bungalow in Muar, Johor. 9122 sq.ft, 6 Bedroom, 7 Bathroom, Freehold, ID 114200767. Find your next property on Mudah.my.",mudah.my,2026-05-29T16:15:45.427951+00:00,
https://www.mudah.my/nusa-bestari-nusavilla-skudai-2-storey-townhouse-full-loan-cash-out-114828957.htm,https://www.mudah.my/nusa-bestari-nusavilla-skudai-2-storey-townhouse-full-loan-cash-out-114828957.htm,134861953,Nusa Bestari Nusavilla Skudai|2-Storey Townhouse|Full Loan + Cash Out,"For Sale Rm499k<br><br>Nusavilla, Jalan Jati 11, Taman Nusa Bestari Jaya, 81300 Skudai, Johor.<br><br>Unblocked unit<br>4 Bedrooms <br>3 Bathrooms<br>1511 sqft<br>Freehold<br>2 Car Park<br>24 Hours Gated & Guarded <br>Facility : Swimming Pool, Gymnasium, Steam Room, BBQ Area<br>Maintenance fee Rm261 monthly<br>Call/Whatsapp 01156852823",,,,House,499000.0,"RM 499,000",MYR,,johor,Skudai,Johor,,81300,,,For Sale,townhouse,,1511,,,4,3,,,,,,,,,,,,,,,,,,4.0,,,,,,,,,,,,,"[""https://cdn.rnudah.com/images/plain/23347c5907c575c81f077d939e2bb948-2985375644112776208.jpg""]",1,,,,,72831,"E - 12154, REN 72831 All ads from this advertiser (35 For Sale) Mortgage Estimation RM 1,989 Estimated monthly installment (Interest rate 4.0%) Property Price Loan Interest (%) Loan Amount Loan Tenure (Ye * This is for reference only and is not a quote. Results vary according to different financial institutions. Mudah.my doesn't guarantee it's accuracy or applicability to your circumstances. Is this your ad? Manage it using these links: Edit Delete Sold Bump Share This Ad Is this ad suspicious or inappropriate? Report this Ad ( List-ID: 114828957 ) Contact Agent Pakar Hartanah Johor JE Property agent VP Realty Firm: E - 12154, REN 72831 All ads from this advertiser (35 For Sale) Mortgage Estimation RM 1,989 Estimated monthly installment (Interest rate 4.0%) Property Price Loan Interest (%) Loan Amount Loan Tenure (Ye * This is for reference only and is not a quote. Results vary according to different financial institutions. Mudah.my doesn't guarantee it's accuracy or applicability to your circumstances. Is this your ad? Manage it using these links: Edit Delete Sold Bump Share This Ad Is this ad suspicious or inappropriate? Report this Ad ( List-ID: 114828957 ) More picks below Back to Top",,35,,,"Townhouse for Sale, 4 Bedroom, 1511 sq.ft, Skudai, Johor 114828957 | Mudah.my","Explore Townhouse for Sale for RM 499,000 Nusa Bestari Nusavilla Skudai|2-Storey Townhouse|Full Loan + Cash Out in Skudai, Johor. 1511 sq.ft, 4 Bedroom, 3 Bathroom, Freehold, ID 114828957. Find your next property on Mudah.my.",https://cdn.rnudah.com/images/plain/23347c5907c575c81f077d939e2bb948-2985375644112776208.jpg,"Explore Townhouse for Sale for RM 499,000 Nusa Bestari Nusavilla Skudai|2-Storey Townhouse|Full Loan + Cash Out in Skudai, Johor. 1511 sq.ft, 4 Bedroom, 3 Bathroom, Freehold, ID 114828957. Find your next property on Mudah.my.",mudah.my,2026-05-29T16:16:32.047719+00:00,
https://www.mudah.my/nusantara-prima-double-storey-cluster-house-114429746.htm,https://www.mudah.my/nusantara-prima-double-storey-cluster-house-114429746.htm,134412797,Nusantara prima Double Storey Cluster House,"---------------<br>For Sales:RM720k net<br>Bankvalue 800k<br>Address: xx, Jalan Prima 5/xx ,Taman Nusantara Prima,79200 Nusajaya.<br><br>Type : Double Storey Cluster House<br>Tenure :  Freehold Non Bumi<br>Bedroom : 4+1<br>Bathroom : 4<br>Land size : 32x70<br>Furnishing: no<br>Renovation :no<br>Direction: tbc<br>Facing: House<br>G&G : No<br>Maintenance Fee : No<br>Reason for sale: Investment<br><br>Available call 0167042980 Bryan Ng",,,,House,720000.0,"RM 720,000",MYR,,johor,Gelang Patah,Johor,,79200,,,For Sale,double-storey,,2100,,,4,4,,,,,,,,,,,,,,,,,,4.0,,,,,,,,,,,,,"[""https://cdn.rnudah.com/images/plain/d90801b47b314a792f6d1450935e4312-2979002400325319616.jpg"", ""https://cdn.rnudah.com/images/plain/8ede5520feff46f8a4b003e60f61f99c-2979002394517851439.jpg"", ""https://cdn.rnudah.com/images/plain/62616237bad238f112017c8c11106fff-2979002390859959599.jpg"", ""https://cdn.rnudah.com/images/plain/3a6d24b59ef6a5b7155aeabd3afbc5bf-2979002392672161071.jpg"", ""https://cdn.rnudah.com/images/plain/4b2be544dfce13f185e3e3e0a2324503-2979002399014538543.jpg""]",5,,,,,54634,"E - 12108, REN 54634 All ads from this advertiser (103 For Sale) Mortgage Estimation RM 2,869 Estimated monthly installment (Interest rate 4.0%) Property Price Loan Interest (%) Loan Amount Loan Tenure (Ye * This is for reference only and is not a quote. Results vary according to different financial institutions. Mudah.my doesn't guarantee it's accuracy or applicability to your circumstances. Is this your ad? Manage it using these links: Edit Delete Sold Bump Share This Ad Is this ad suspicious or inappropriate? Report this Ad ( List-ID: 114429746 ) Contact Agent Bryan Ng Property agent – Agent ID Checked Vag Properties Sdn Bhd Firm: E - 12108, REN 54634 All ads from this advertiser (103 For Sale) Mortgage Estimation RM 2,869 Estimated monthly installment (Interest rate 4.0%) Property Price Loan Interest (%) Loan Amount Loan Tenure (Ye * This is for reference only and is not a quote. Results vary according to different financial institutions. Mudah.my doesn't guarantee it's accuracy or applicability to your circumstances. Is this your ad? Manage it using these links: Edit Delete Sold Bump Share This Ad Is this ad suspicious or inappropriate? Report this Ad ( List-ID: 114429746 ) More picks below Back to Top",True,103,,,"2-storey Terraced House for Sale, 4 Bedroom, 2100 sq.ft, Gelang Patah, Johor 114429746 | Mudah.my","Explore 2-storey Terraced House for Sale for RM 720,000 Nusantara prima Double Storey Cluster House in Gelang Patah, Johor. 2100 sq.ft, 4 Bedroom, 4 Bathroom, Freehold, ID 114429746. Find your next property on Mudah.my.",https://cdn.rnudah.com/images/plain/d90801b47b314a792f6d1450935e4312-2979002400325319616.jpg,"Explore 2-storey Terraced House for Sale for RM 720,000 Nusantara prima Double Storey Cluster House in Gelang Patah, Johor. 2100 sq.ft, 4 Bedroom, 4 Bathroom, Freehold, ID 114429746. Find your next property on Mudah.my.",mudah.my,2026-05-29T17:23:04.205644+00:00,
https://www.mudah.my/nusavilla-nusa-bestari-townhouse-114802439.htm,https://www.mudah.my/nusavilla-nusa-bestari-townhouse-114802439.htm,134807137,Nusavilla @ Nusa Bestari Townhouse,"3-6 minutes to Bestari Pasar, Post Office, Bank, School, Cafe, Restaurant and Petrol Station  <br>7 minutes to Sutera Mall <br>9 minutes to AEON Mall Bukit Indah<br>22 minutes to 2nd Link Tuas CIQ <br>22 minutes to Toppen Shopping Centre / IKEA <br>23 minutes to CIQ JB Sentral  <br>24 minutes to Mid Valley Southkey The Mall  <br><br>Nice location <br>Call for more information and viewing YuBo 0167160100 (REN43602)<br>Welcome owner I will give 100% of my professional service for you",,,,House,468000.0,"RM 468,000",MYR,,johor,Johor Bahru,Johor,,31777,,,For Sale,townhouse,,1066,,,3,2,,,,,,,,,,,,,,,,,,4.0,,,,,,,,,,,,,"[""https://cdn.rnudah.com/images/plain/0792c8ff91873f00da704f9a04be47a8-2984566607146293957.jpg"", ""https://cdn.rnudah.com/images/plain/0e0ae3d42a3b076e1e99a987186e9814-2984566612448404671.jpg"", ""https://cdn.rnudah.com/images/plain/b3a98c4c3a0e1d33b677d4f3eca308f2-2984566619763022533.jpg"", ""https://cdn.rnudah.com/images/plain/5fa731a24a95db9777f6898a9ce56f94-2984566626021055173.jpg"", ""https://cdn.rnudah.com/images/plain/bb8d695024d357b77ae5cda7426f490c-2984566630870049983.jpg"", ""https://mcdn.mudah.my/static-assets/images/adview/freehold.svg"", ""https://mcdn.mudah.my/static-assets/images/adview/road.svg"", ""https://mcdn.mudah.my/static-assets/images/adview/stores.svg"", ""https://mcdn.mudah.my/static-assets/images/adview/house.svg"", ""https://www.facebook.com/tr?id=632307416906311&ev=ViewContent&cd[content_type]=product&cd[content_ids]=114802439&cd[value]=468000&cd[currency]=MYR&cd[content_category]=2000%20%7C%20properties&noscript=1""]",10,,,,https://img.rnudah.com/stores/logo_900200_xax.jpg,43602,"E - 31777, REN 43602 All ads from this advertiser (54 For Sale, 2 For Rent) Mortgage Estimation RM 1,865 Estimated monthly installment (Interest rate 4.0%) Property Price Loan Interest (%) Loan Amount Loan Tenure (Years) * This is for reference only and is not a quote. Results vary according to different financial institutions. Mudah.my doesn't guarantee it's accuracy or applicability to your circumstances. Is this your ad? Manage it using these links: Edit Delete Sold Bump Share This Ad Is this ad suspicious or inappropriate? Report this Ad ( List-ID: 114802439 ) Contact Agent WhatsApp 016716**** ShyanOng Property agent Vigor Properties Firm: E - 31777, REN 43602 All ads from this advertiser (54 For Sale, 2 For Rent) Mortgage Estimation RM 1,865 Estimated monthly installment (Interest rate 4.0%) Property Price Loan Interest (%) Loan Amount Loan Tenure (Years) * This is for reference only and is not a quote. Results vary according to different financial institutions. Mudah.my doesn't guarantee it's accuracy or applicability to your circumstances. Is this your ad? Manage it using these links: Edit Delete Sold Bump Share This Ad Is this ad suspicious or inappropriate? Report this Ad ( List-ID: 114802439 ) More picks below Back to Top",,54,,,"Townhouse for Sale, 3 Bedroom, 1066 sq.ft, Johor Bahru, Johor 114802439 | Mudah.my","Explore Townhouse for Sale for RM 468,000 Nusavilla @ Nusa Bestari Townhouse in Johor Bahru, Johor. 1066 sq.ft, 3 Bedroom, 2 Bathroom, Freehold, ID 114802439. Find your next property on Mudah.my.",https://cdn.rnudah.com/images/plain/0792c8ff91873f00da704f9a04be47a8-2984566607146293957.jpg,"Explore Townhouse for Sale for RM 468,000 Nusavilla @ Nusa Bestari Townhouse in Johor Bahru, Johor. 1066 sq.ft, 3 Bedroom, 2 Bathroom, Freehold, ID 114802439. Find your next property on Mudah.my.",mudah.my,2026-05-29T18:21:01.702850+00:00,
https://www.mudah.my/nusavilla-townhouse-for-sell-114177935.htm,https://www.mudah.my/nusavilla-townhouse-for-sell-114177935.htm,134132388,Nusavilla townhouse for sell,Big unit<br><br>Good enviroment,,,,Apartment / Condominium,500000.0,"RM 500,000",MYR,,johor,Johor Bahru,Johor,"Jalan Jati 11, Taman Nusa Bestari Jaya, 81300 Johor Bahru, Johor",81300,,,For Sale,townhouse,,1500,,,4,3,,,,,,,,,,,,,,,,,,4.0,,,,,,,More on Nusavilla,https://www.mudah.my/property/properties-in-nusavilla-johor,COUNTRY VIEW BERHAD,,,,"[""https://cdn.rnudah.com/images/plain/0a4de73e94c2247c05459b1240fd4c32-2974379006284796015.jpg"", ""https://cdn.rnudah.com/images/plain/548bf1bd291fc23e9ee8d94bacdb5ea5-2974379006721647152.jpg"", ""https://cdn.rnudah.com/images/plain/cd3f503a960639e7bf547c474f1cfbee-2974379006391571179.jpg"", ""https://cdn.rnudah.com/images/plain/f35d97c84a7422b241a039d7b87f4890-2974379006866484699.jpg"", ""https://cdn.rnudah.com/images/plain/3d275ae15bd43b97b0bb7ce57703db62-2974379006337842898.jpg"", ""https://mcdn.mudah.my/static-assets/images/adview/freehold.svg"", ""https://mcdn.mudah.my/static-assets/images/adview/parking.svg"", ""https://mcdn.mudah.my/static-assets/images/adview/pool.svg"", ""https://www.facebook.com/tr?id=632307416906311&ev=ViewContent&cd[content_type]=product&cd[content_ids]=114177935&cd[value]=500000&cd[currency]=MYR&cd[content_category]=2000%20%7C%20properties&noscript=1""]",9,,,,,,,,,,,"Townhouse Condo for Sale, 4 Bedroom, 1500 sq.ft, Nusavilla, Johor Bahru, Johor 114177935 | Mudah.my","Explore Townhouse Condo for Sale for RM 500,000 in Nusavilla, Johor Bahru, Johor. 1500 sq.ft, 4 Bedroom, 3 Bathroom, Freehold, Parking, Security, Swimming Pool, Playground, Gymnasium, Jogging Track, Tennis Court, Squash Court, ID 114177935. Find your next property on Mudah.my.",https://cdn.rnudah.com/images/plain/0a4de73e94c2247c05459b1240fd4c32-2974379006284796015.jpg,"Explore Townhouse Condo for Sale for RM 500,000 in Nusavilla, Johor Bahru, Johor. 1500 sq.ft, 4 Bedroom, 3 Bathroom, Freehold, Parking, Security, Swimming Pool, Playground, Gymnasium, Jogging Track, Tennis Court, Squash Court, ID 114177935. Find your next property on Mudah.my.",mudah.my,2026-05-29T03:55:37.435118+00:00,
