listing_url,canonical_url,list_id,title,description,posted_at,ad_status,is_featured,category_name,price,price_display,currency,price_per_sqft,region,area,state,full_address,postcode,latitude,longitude,transaction_type,property_type,property_sub_type,size_sqft,land_area,land_area_unit,bedrooms,bathrooms,carpark,floor_range,total_floors_unit,furnishing,condition,facing_direction,unit_type,is_tenanted,tenure_type,remaining_tenure,land_title,strata_title,maintenance_fee,assessment_tax,deposit_months,utility_deposit_months,mortgage_estimate,mortgage_rate,facilities_list,nearby_bus_stops,nearby_schools,nearby_parks,nearby_hospitals,nearby_shopping,development_name,development_url,developer,completion_year,total_floors,total_units,image_urls,image_count,seller_name,seller_type,seller_profile_url,seller_logo_url,ren_number,firm_license,is_verified,total_ads,agent_phone,agent_whatsapp,og_title,og_description,og_image,meta_description,source,scraped_at,raw_attributes
https://www.mudah.my/skudai-baru-double-storey-terrace-house-unblock-view-unit-114881891.htm,https://www.mudah.my/skudai-baru-double-storey-terrace-house-unblock-view-unit-114881891.htm,134921692,Skudai Baru Double Storey Terrace House Unblock View Unit,"For Sale Skudai Baru 2 Storey Terrace<br>Land Size: 20 x 70 sqft Selling: RM 565K<br>Jalan Hang Kasturi, Skudai Baru 东方花园<br><br>Double Storey Terrace House 双层排楼<br><br>Land Size: 1400 sqft<br>20 x 70<br>4 Bedrooms<br>3 Bathrooms<br>Freehold<br>Non Bumi Lot <br>Facing: NorthWest<br>Unblock View<br>Nearby Tun Animah, Nusa Bestari <br><br>Asking Price: RM 565,000<br><br>Iden Tan  ( REN 27908 )<br>Pls call/ whatapps <br>013-367 7613<br>www.wasap.my/60133677613<br><br>Proplink <br>Union Properties [ E (3) 1329 ]<br><br>#Proplink <br>#Unionproperties",,,,House,565000.0,"RM 565,000",MYR,,johor,Skudai,Johor,,27908,,,For Sale,double-storey,,1400,,,4,3,,,,,,,,,,,,,,,,,,4.0,,,,,,,,,,,,,"[""https://cdn.rnudah.com/images/plain/512be5cb5b590f187b91af0ea08c6e85-2986419133604943843.jpg"", ""https://cdn.rnudah.com/images/plain/4d109b5e7b6e50608bab86704e6554be-2986419134335472041.jpg"", ""https://cdn.rnudah.com/images/plain/497e3e8507832572e3d8c680bcaedd09-2986419133815247273.jpg"", ""https://cdn.rnudah.com/images/plain/7bace18bed8c639b99bf54509a67aa36-2986419134897051619.jpg"", ""https://cdn.rnudah.com/images/plain/aea3d09bcb674e41bbe04151780addab-2986419133940553699.jpg""]",5,,,,https://img.rnudah.com/stores/logo_852635_sil.jpg,27908,"E - 31329, REN 27908 All ads from this advertiser (89 For Sale, 5 For Rent) Mortgage Estimation RM 2,252 Estimated monthly installment (Interest rate 4.0%) Property Price Loan Interest (%) Loan Amount Loan Tenure (Ye * This is for reference only and is not a quote. Results vary according to different financial institutions. Mudah.my doesn't guarantee it's accuracy or applicability to your circumstances. Is this your ad? Manage it using these links: Edit Delete Sold Bump Share This Ad Is this ad suspicious or inappropriate? Report this Ad ( List-ID: 114881891 ) Contact Agent Iden Tan Property agent – Agent ID Checked Union Properties Firm: E - 31329, REN 27908 All ads from this advertiser (89 For Sale, 5 For Rent) Mortgage Estimation RM 2,252 Estimated monthly installment (Interest rate 4.0%) Property Price Loan Interest (%) Loan Amount Loan Tenure (Ye * This is for reference only and is not a quote. Results vary according to different financial institutions. Mudah.my doesn't guarantee it's accuracy or applicability to your circumstances. Is this your ad? Manage it using these links: Edit Delete Sold Bump Share This Ad Is this ad suspicious or inappropriate? Report this Ad ( List-ID: 114881891 ) More picks below Back to Top",True,89,,,"2-storey Terraced House for Sale, 4 Bedroom, 1400 sq.ft, Skudai, Johor 114881891 | Mudah.my","Explore 2-storey Terraced House for Sale for RM 565,000 Skudai Baru Double Storey Terrace House Unblock View Unit in Skudai, Johor. 1400 sq.ft, 4 Bedroom, 3 Bathroom, Freehold, ID 114881891. Find your next property on Mudah.my.",https://cdn.rnudah.com/images/plain/512be5cb5b590f187b91af0ea08c6e85-2986419133604943843.jpg,"Explore 2-storey Terraced House for Sale for RM 565,000 Skudai Baru Double Storey Terrace House Unblock View Unit in Skudai, Johor. 1400 sq.ft, 4 Bedroom, 3 Bathroom, Freehold, ID 114881891. Find your next property on Mudah.my.",mudah.my,2026-05-29T16:15:45.219953+00:00,
https://www.mudah.my/skudai-single-storey-house-for-sale-114881874.htm,https://www.mudah.my/skudai-single-storey-house-for-sale-114881874.htm,134920724,Skudai Single Storey House for Sale,"Skudai Single Storey House for Sale (can full loan)<br><br>* Address : Jalan Ronggeng, Skudai Baru<br>* Type of House: Single Storey Terrace house <br>* Size : 22x70<br>* Bedroom : 3<br>* Bathroom : 2<br>* Freehold / Leasehold:  Leasehold till 2089 <br>* Bumi / Non Bumi / Bumi Release: Non bumi<br>* Facing : House <br>* Direction : NorthEast<br>* Maintenance Fee : -<br>* Corner Lot / Intermediate Lot / End Lot : Intermediate lot<br>* Reason for sell : Upgrade<br>* Year of Purchase : 2008<br><br>For Sale: RM498k <br>*below bank value*<br><br>please contact Albert Tey 012-7093028",,,,House,498000.0,"RM 498,000",MYR,,johor,Skudai,Johor,,12053,,,For Sale,single-storey,,1540,,,3,2,,,,,,,,,,,,,,,,,,4.0,,,,,,,,,,,,,"[""https://customer-76ekbudsmzsbwunl.cloudflarestream.com/80a8db3411e23041b0fd2dbb1272e59f/thumbnails/thumbnail.jpg?fit=clip&height=480&width=640"", ""https://cdn.rnudah.com/images/plain/f352c802d6c73c02bee29e14ac9d59b1-2986409773177886691.jpg"", ""https://cdn.rnudah.com/images/plain/baa73ee3d86d9ab3a5dc02586e973611-2986409774084052963.jpg"", ""https://cdn.rnudah.com/images/plain/df8e6621c3c6860ad03cae5cf44a61b5-2986409775426426851.jpg"", ""https://cdn.rnudah.com/images/plain/53be1360389d76e978e263a9f6925c82-2986409774084575657.jpg"", ""https://www.facebook.com/tr?id=632307416906311&ev=ViewContent&cd[content_type]=product&cd[content_ids]=114881874&cd[value]=498000&cd[currency]=MYR&cd[content_category]=2000%20%7C%20properties&noscript=1""]",6,,,,,52785,"E - 12053, REN 52785 All ads from this advertiser (7 For Sale, 4 For Rent) Mortgage Estimation RM 1,985 Estimated monthly installment (Interest rate 4.0%) Property Price Loan Interest (%) Loan Amount Loan Tenure (Years) * This is for reference only and is not a quote. Results vary according to different financial institutions. Mudah.my doesn't guarantee it's accuracy or applicability to your circumstances. Is this your ad? Manage it using these links: Edit Delete Sold Bump Share This Ad Is this ad suspicious or inappropriate? Report this Ad ( List-ID: 114881874 ) Contact Agent WhatsApp 012709**** Albert Tey Property agent ERA Realtor Sdn Bhd Firm: E - 12053, REN 52785 All ads from this advertiser (7 For Sale, 4 For Rent) Mortgage Estimation RM 1,985 Estimated monthly installment (Interest rate 4.0%) Property Price Loan Interest (%) Loan Amount Loan Tenure (Years) * This is for reference only and is not a quote. Results vary according to different financial institutions. Mudah.my doesn't guarantee it's accuracy or applicability to your circumstances. Is this your ad? Manage it using these links: Edit Delete Sold Bump Share This Ad Is this ad suspicious or inappropriate? Report this Ad ( List-ID: 114881874 ) More picks below Back to Top",,2008,,,"1-storey Terraced House for Sale, 3 Bedroom, 1540 sq.ft, Skudai, Johor 114881874 | Mudah.my","Explore 1-storey Terraced House for Sale for RM 498,000 Skudai Single Storey House for Sale in Skudai, Johor. 1540 sq.ft, 3 Bedroom, 2 Bathroom, Leasehold, ID 114881874. Find your next property on Mudah.my.",https://cdn.rnudah.com/images/plain/f352c802d6c73c02bee29e14ac9d59b1-2986409773177886691.jpg,"Explore 1-storey Terraced House for Sale for RM 498,000 Skudai Single Storey House for Sale in Skudai, Johor. 1540 sq.ft, 3 Bedroom, 2 Bathroom, Leasehold, ID 114881874. Find your next property on Mudah.my.",mudah.my,2026-05-29T17:17:42.232174+00:00,
https://www.mudah.my/skudai-taman-damai-jaya-jalan-makmur-l-cost-double-storey-house-114407550.htm,https://www.mudah.my/skudai-taman-damai-jaya-jalan-makmur-l-cost-double-storey-house-114407550.htm,134388555,Skudai Taman Damai Jaya Jalan Makmur L.Cost Double Storey House,🐎🤠🐎*SKUDAI TAMAN DAMAI JAYA  JALAN MAKMUR LOW COST DOUBLE STOREY TERRACE HOUSE*<br><br>🤓 Jalan Makmur Taman Damai Jaya 81300 Skudai Low Cost Double Storey Terrace House*<br><br>✔️3 Bedrooms 2 Bathrooms <br>✔️770sqft<br>✔️Freehold<br>✔️Non Bumi Lot (All Race Welcome)<br>✔️Intermidate Lot <br>✔️Reno Unit <br>-Kitchen Extended <br><br>😘 *SELLING PRICE RM358K*<br>😘 *MARKET VALUE TBC*<br><br>we sale property below bank value to help buyers less cash out or without the 10% deposit ... call or whatssap us for free property Consultation <br><br>CALL OR WTZP<br>0164302461 JB Max,,,,House,358000.0,"RM 358,000",MYR,,johor,Skudai,Johor,Skudai Taman Damai Jaya Jalan Makmur L.Cost Double Storey House,81300,,,For Sale,double-storey,,770,,,3,2,,,,,,,,,,,,,,,,,,4.0,,,,,,,,,,,,,"[""https://cdn.rnudah.com/images/plain/d65438faca88d024488b85e3a0663dd1-2978704192950258991.jpg"", ""https://cdn.rnudah.com/images/plain/06826ccf877ab11fb43de9bea46b55e4-2978704194040843567.jpg"", ""https://cdn.rnudah.com/images/plain/b0a2e4776b34fe3688600feb47896339-2978704194739478321.jpg"", ""https://cdn.rnudah.com/images/plain/c0729360db9751bb2492e7c0f3e86df7-2978704197111139631.jpg"", ""https://cdn.rnudah.com/images/plain/0c93ba55f5300101ddfdc99212a8f3a5-2978704198397042481.jpg""]",5,,,,,30599,"E - 11934, REN 30599 All ads from this advertiser (431 For Sale, 1 For Rent) Mortgage Estimation RM 1,427 Estimated monthly installment (Interest rate 4.0%) Property Price Loan Interest (%) Loan Amount Loan Tenure (Ye * This is for reference only and is not a quote. Results vary according to different financial institutions. Mudah.my doesn't guarantee it's accuracy or applicability to your circumstances. Is this your ad? Manage it using these links: Edit Delete Sold Bump Share This Ad Is this ad suspicious or inappropriate? Report this Ad ( List-ID: 114407550 ) Contact Agent JB Max Property agent – Agent ID Checked Royce Properties Firm: E - 11934, REN 30599 All ads from this advertiser (431 For Sale, 1 For Rent) Mortgage Estimation RM 1,427 Estimated monthly installment (Interest rate 4.0%) Property Price Loan Interest (%) Loan Amount Loan Tenure (Ye * This is for reference only and is not a quote. Results vary according to different financial institutions. Mudah.my doesn't guarantee it's accuracy or applicability to your circumstances. Is this your ad? Manage it using these links: Edit Delete Sold Bump Share This Ad Is this ad suspicious or inappropriate? Report this Ad ( List-ID: 114407550 ) More picks below Back to Top",True,431,,,"2-storey Terraced House for Sale, 3 Bedroom, 770 sq.ft, Skudai, Johor 114407550 | Mudah.my","Explore 2-storey Terraced House for Sale for RM 358,000 Skudai Taman Damai Jaya Jalan Makmur L.Cost Double Storey House in Skudai, Johor. 770 sq.ft, 3 Bedroom, 2 Bathroom, Freehold, ID 114407550. Find your next property on Mudah.my.",https://cdn.rnudah.com/images/plain/d65438faca88d024488b85e3a0663dd1-2978704192950258991.jpg,"Explore 2-storey Terraced House for Sale for RM 358,000 Skudai Taman Damai Jaya Jalan Makmur L.Cost Double Storey House in Skudai, Johor. 770 sq.ft, 3 Bedroom, 2 Bathroom, Freehold, ID 114407550. Find your next property on Mudah.my.",mudah.my,2026-05-29T17:06:22.173225+00:00,
https://www.mudah.my/skudai-taman-nusa-bestari-jalan-jati-nusa-villa-townhouse-114824597.htm,https://www.mudah.my/skudai-taman-nusa-bestari-jalan-jati-nusa-villa-townhouse-114824597.htm,134857114,Skudai｜Taman Nusa Bestari｜Jalan Jati｜Nusa Villa Townhouse｜,"⛳ Nusa Villa Townhouse For Sale – Nusa Bestari Jaya<br><br>📍 C4-X XX, Nusavilla,Jalan Jati 11,Taman Nusa Bestari Jaya,81300 Skudai, Johor<br><br>Property Details:<br>✅ Freehold<br>✅ Unblocked Unit<br>✅ 2 Storey Townhouse<br>✅ Built-up: 1,511 sqft (Large Unit)<br>✅ 4 Bedrooms<br>✅ 3 Bathrooms<br>✅ 2 Car Parks<br>✅ 24 Hours Gated & Guarded<br><br>Furnishing & Features:<br>✨ 3 bedrooms with built-in cabinets<br>✨ 4 air conditioners<br>✨ 3 water heaters<br>✨ Clean & well maintained<br>✨ Move-in condition<br><br>Facilities:<br>🏊 Swimming Pool<br>🏋️ Gymnasium<br>💨 Steam Room<br>🍖 BBQ Area<br><br>Maintenance Fee:🔹 RM261 / month<br><br>⭐ Welcome Co-Broke ⭐<br><br>📲 For Viewing & More Information:<br>011-6231 4134",,,,House,499000.0,"RM 499,000",MYR,,johor,Skudai,Johor,Skudai｜Taman Nusa Bestari｜Jalan Jati｜Nusa Villa Townhouse｜,81300,,,For Sale,townhouse,,1511,,,4,3,,,,,,,,,,,,,,,,,,4.0,,,,,,,,,,,,,"[""https://cdn.rnudah.com/images/plain/156e53a608e00abee38e04b0f7642f64-2985278692095565987.jpg"", ""https://cdn.rnudah.com/images/plain/7a4f2da2737dba7af04c3ee548626748-2985278691988663312.jpg"", ""https://cdn.rnudah.com/images/plain/ea5c2967341b5449dc688b6789c3959f-2985278692280180899.jpg"", ""https://cdn.rnudah.com/images/plain/3f21047230a7112dc1b5a9b7e3aebdf2-2985278692524551461.jpg"", ""https://cdn.rnudah.com/images/plain/57406b8a0d102dc4e0a617f4ee2f0d39-2985278692021103909.jpg"", ""https://mcdn.mudah.my/static-assets/images/adview/freehold.svg"", ""https://mcdn.mudah.my/static-assets/images/adview/renovated.svg"", ""https://mcdn.mudah.my/static-assets/images/adview/garden.svg"", ""https://www.facebook.com/tr?id=632307416906311&ev=ViewContent&cd[content_type]=product&cd[content_ids]=114824597&cd[value]=499000&cd[currency]=MYR&cd[content_category]=2000%20%7C%20properties&noscript=1""]",9,,,,,72836,"E - 11321, REN 72836 All ads from this advertiser (163 For Sale) Mortgage Estimation RM 1,989 Estimated monthly installment (Interest rate 4.0%) Property Price Loan Interest (%) Loan Amount Loan Tenure (Years) * This is for reference only and is not a quote. Results vary according to different financial institutions. Mudah.my doesn't guarantee it's accuracy or applicability to your circumstances. Is this your ad? Manage it using these links: Edit Delete Sold Bump Share This Ad Is this ad suspicious or inappropriate? Report this Ad ( List-ID: 114824597 ) Contact Agent WhatsApp 0116231**** Rumah Pertama Johor Property agent – Agent ID Checked VP REALTY SDN BHD Firm: E - 11321, REN 72836 All ads from this advertiser (163 For Sale) Mortgage Estimation RM 1,989 Estimated monthly installment (Interest rate 4.0%) Property Price Loan Interest (%) Loan Amount Loan Tenure (Years) * This is for reference only and is not a quote. Results vary according to different financial institutions. Mudah.my doesn't guarantee it's accuracy or applicability to your circumstances. Is this your ad? Manage it using these links: Edit Delete Sold Bump Share This Ad Is this ad suspicious or inappropriate? Report this Ad ( List-ID: 114824597 ) More picks below Back to Top",True,163,,,"Townhouse for Sale, 4 Bedroom, 1511 sq.ft, Skudai, Johor 114824597 | Mudah.my","Explore Townhouse for Sale for RM 499,000 Skudai｜Taman Nusa Bestari｜Jalan Jati｜Nusa Villa Townhouse｜ in Skudai, Johor. 1511 sq.ft, 4 Bedroom, 3 Bathroom, Freehold, ID 114824597. Find your next property on Mudah.my.",https://cdn.rnudah.com/images/plain/156e53a608e00abee38e04b0f7642f64-2985278692095565987.jpg,"Explore Townhouse for Sale for RM 499,000 Skudai｜Taman Nusa Bestari｜Jalan Jati｜Nusa Villa Townhouse｜ in Skudai, Johor. 1511 sq.ft, 4 Bedroom, 3 Bathroom, Freehold, ID 114824597. Find your next property on Mudah.my.",mudah.my,2026-05-29T18:16:48.962291+00:00,
https://www.mudah.my/skudai-taman-nusa-bestari-jalan-jati-nusa-villa-townhouse-114859855.htm,https://www.mudah.my/skudai-taman-nusa-bestari-jalan-jati-nusa-villa-townhouse-114859855.htm,134896783,Skudai｜Taman Nusa Bestari｜Jalan Jati Nusa Villa Townhouse｜,"⛳ Nusa Villa Townhouse For Sale – Nusa Bestari Jaya<br><br>📍 C4-X XX, Nusavilla,Jalan Jati 11,Taman Nusa Bestari Jaya,81300 Skudai, Johor<br><br>Property Details:<br>✅ Freehold<br>✅ Unblocked Unit<br>✅ 2 Storey Townhouse<br>✅ Built-up: 1,511 sqft (Large Unit)<br>✅ 4 Bedrooms<br>✅ 3 Bathrooms<br>✅ 2 Car Parks<br>✅ 24 Hours Gated & Guarded<br><br>Furnishing & Features:<br>✨ 3 bedrooms with built-in cabinets<br>✨ 4 air conditioners<br>✨ 3 water heaters<br>✨ Clean & well maintained<br>✨ Move-in condition<br><br>Facilities:<br>🏊 Swimming Pool<br>🏋️ Gymnasium<br>💨 Steam Room<br>🍖 BBQ Area<br><br>Maintenance Fee:🔹 RM261 / month<br><br>⭐ Welcome Co-Broke ⭐<br><br>📲 For Viewing & More Information:<br>011-6231 4134",,,,House,499000.0,"RM 499,000",MYR,,johor,Skudai,Johor,Skudai｜Taman Nusa Bestari｜Jalan Jati Nusa Villa Townhouse｜,81300,,,For Sale,townhouse,,1511,,,4,3,,,,,,,,,,,,,,,,,,4.0,,,,,,,,,,,,,"[""https://cdn.rnudah.com/images/plain/151cc795ca1efcbf3e47aa41121f40ad-2985967561678711824.jpg"", ""https://cdn.rnudah.com/images/plain/a574e3f611282ed988c8bd4209234ce5-2985967561426988048.jpg"", ""https://cdn.rnudah.com/images/plain/66d3909ba94dbc88958c8118c9ecf6d1-2985967561069161765.jpg"", ""https://cdn.rnudah.com/images/plain/0fdf519d99bdbf26e164e7734551a8f6-2985967561134936416.jpg"", ""https://cdn.rnudah.com/images/plain/a609f6b75b68a11e2eb91c1fba0597d8-2985967561220222245.jpg"", ""https://mcdn.mudah.my/static-assets/images/adview/freehold.svg"", ""https://mcdn.mudah.my/static-assets/images/adview/renovated.svg"", ""https://mcdn.mudah.my/static-assets/images/adview/garden.svg"", ""https://www.facebook.com/tr?id=632307416906311&ev=ViewContent&cd[content_type]=product&cd[content_ids]=114859855&cd[value]=499000&cd[currency]=MYR&cd[content_category]=2000%20%7C%20properties&noscript=1""]",9,,,,,72836,"E - 11321, REN 72836 All ads from this advertiser (163 For Sale) Mortgage Estimation RM 1,989 Estimated monthly installment (Interest rate 4.0%) Property Price Loan Interest (%) Loan Amount Loan Tenure (Years) * This is for reference only and is not a quote. Results vary according to different financial institutions. Mudah.my doesn't guarantee it's accuracy or applicability to your circumstances. Is this your ad? Manage it using these links: Edit Delete Sold Bump Share This Ad Is this ad suspicious or inappropriate? Report this Ad ( List-ID: 114859855 ) Contact Agent WhatsApp 0116231**** Rumah Pertama Johor Property agent – Agent ID Checked VP REALTY SDN BHD Firm: E - 11321, REN 72836 All ads from this advertiser (163 For Sale) Mortgage Estimation RM 1,989 Estimated monthly installment (Interest rate 4.0%) Property Price Loan Interest (%) Loan Amount Loan Tenure (Years) * This is for reference only and is not a quote. Results vary according to different financial institutions. Mudah.my doesn't guarantee it's accuracy or applicability to your circumstances. Is this your ad? Manage it using these links: Edit Delete Sold Bump Share This Ad Is this ad suspicious or inappropriate? Report this Ad ( List-ID: 114859855 ) More picks below Back to Top",True,163,,,"Townhouse for Sale, 4 Bedroom, 1511 sq.ft, Skudai, Johor 114859855 | Mudah.my","Explore Townhouse for Sale for RM 499,000 Skudai｜Taman Nusa Bestari｜Jalan Jati Nusa Villa Townhouse｜ in Skudai, Johor. 1511 sq.ft, 4 Bedroom, 3 Bathroom, Freehold, ID 114859855. Find your next property on Mudah.my.",https://cdn.rnudah.com/images/plain/151cc795ca1efcbf3e47aa41121f40ad-2985967561678711824.jpg,"Explore Townhouse for Sale for RM 499,000 Skudai｜Taman Nusa Bestari｜Jalan Jati Nusa Villa Townhouse｜ in Skudai, Johor. 1511 sq.ft, 4 Bedroom, 3 Bathroom, Freehold, ID 114859855. Find your next property on Mudah.my.",mudah.my,2026-05-29T18:08:38.695920+00:00,
https://www.mudah.my/skudai-taman-sri-yaakob-jalan-putra-shop-service-apartment-level-1-114837792.htm,https://www.mudah.my/skudai-taman-sri-yaakob-jalan-putra-shop-service-apartment-level-1-114837792.htm,134870076,Skudai Taman Sri Yaakob Jalan Putra Shop Service Apartment Level 1,🐎🤓🐎*SKUDAI TAMAN TAN SRI YAAKOB JALAN PUTRA SHOP SERVICE APARTMENT LEVEL 1*<br><br>😘 *Jalan Putra Taman Sri Yaakob 81300 Skudai Shop Service Apartment Level 1*<br><br>✔️Level 1<br>✔️2 Bedrooms 1 Bathrooms <br>✔️700sqft <br>✔️Intermediate Lot <br>✔️ Starts title <br>✔️International Lot <br>✔️Freehold <br>✔️Renovated Unit <br><br>🤠 *SELLING PRICE RM188K*<br>🤠 *MARKET VALUE TBC*<br> <br>we sale property below bank value to help buyers less cash out or without the 10% deposit ... call or whatssap us for free property Consultation <br><br>CALL OR WTZP<br>0164302461 JB Max,,,,Apartment / Condominium,188000.0,"RM 188,000",MYR,,johor,Skudai,Johor,Skudai Taman Sri Yaakob Jalan Putra Shop Service Apartment Level 1,81300,,,For Sale,apartment,,700,,,2,1,,,,,,,,,,,,,,,,,,4.0,,,,,,,More on Taman Tan Sri Yaacob,https://www.mudah.my/property/properties-in-taman-tan-sri-yaacob-johor,,,,,"[""https://cdn.rnudah.com/images/plain/c72dbc3a5d8b2f621ac98d17529b1897-2985512969091738917.jpg""]",1,,,,,30599,"E - 11934, REN 30599 All ads from this advertiser (431 For Sale, 1 For Rent) Mortgage Estimation RM 749 Estimated monthly installment (Interest rate 4.0%) Property Price Loan Interest (%) Loan Amount Loan Tenure (Ye * This is for reference only and is not a quote. Results vary according to different financial institutions. Mudah.my doesn't guarantee it's accuracy or applicability to your circumstances. Is this your ad? Manage it using these links: Edit Delete Sold Bump Share This Ad Is this ad suspicious or inappropriate? Report this Ad ( List-ID: 114837792 ) Contact Agent JB Max Property agent – Agent ID Checked Royce Properties Firm: E - 11934, REN 30599 All ads from this advertiser (431 For Sale, 1 For Rent) Mortgage Estimation RM 749 Estimated monthly installment (Interest rate 4.0%) Property Price Loan Interest (%) Loan Amount Loan Tenure (Ye * This is for reference only and is not a quote. Results vary according to different financial institutions. Mudah.my doesn't guarantee it's accuracy or applicability to your circumstances. Is this your ad? Manage it using these links: Edit Delete Sold Bump Share This Ad Is this ad suspicious or inappropriate? Report this Ad ( List-ID: 114837792 ) More picks below Back to Top",True,431,,,"Flat for Sale, 2 Bedroom, 700 sq.ft, Taman Tan Sri Yaacob, Skudai, Johor 114837792 | Mudah.my","Explore Flat for Sale for RM 188,000 in Taman Tan Sri Yaacob, Skudai, Johor. 700 sq.ft, 2 Bedroom, 1 Bathroom, Freehold, Parking, Playground, ID 114837792. Find your next property on Mudah.my.",https://cdn.rnudah.com/images/plain/c72dbc3a5d8b2f621ac98d17529b1897-2985512969091738917.jpg,"Explore Flat for Sale for RM 188,000 in Taman Tan Sri Yaacob, Skudai, Johor. 700 sq.ft, 2 Bedroom, 1 Bathroom, Freehold, Parking, Playground, ID 114837792. Find your next property on Mudah.my.",mudah.my,2026-05-29T16:13:48.253068+00:00,
