listing_url,canonical_url,list_id,title,description,posted_at,ad_status,is_featured,category_name,price,price_display,currency,price_per_sqft,region,area,state,full_address,postcode,latitude,longitude,transaction_type,property_type,property_sub_type,size_sqft,land_area,land_area_unit,bedrooms,bathrooms,carpark,floor_range,total_floors_unit,furnishing,condition,facing_direction,unit_type,is_tenanted,tenure_type,remaining_tenure,land_title,strata_title,maintenance_fee,assessment_tax,deposit_months,utility_deposit_months,mortgage_estimate,mortgage_rate,facilities_list,nearby_bus_stops,nearby_schools,nearby_parks,nearby_hospitals,nearby_shopping,development_name,development_url,developer,completion_year,total_floors,total_units,image_urls,image_count,seller_name,seller_type,seller_profile_url,seller_logo_url,ren_number,firm_license,is_verified,total_ads,agent_phone,agent_whatsapp,og_title,og_description,og_image,meta_description,source,scraped_at,raw_attributes
https://www.mudah.my/1-unit-akhir-banglo-telaga-putat-setiu-109119333.htm,https://www.mudah.my/1-unit-akhir-banglo-telaga-putat-setiu-109119333.htm,128526433,"1 unit Akhir Banglo Telaga Putat, Setiu","1 𝗨𝗡𝗜𝗧 𝗔𝗞𝗛𝗜𝗥 𝗕𝗔𝗡𝗚𝗟𝗢 𝗔𝗜𝗥 𝗧𝗘𝗥𝗝𝗨𝗡<br>💲 RM335,000<br>🏡 Luas Rumah 1500kp<br>📍Luas Tanah 620mp<br>🚪4 Bilik 🚽3 Bilik air<br>📌Lokasi: https://maps.app.goo.gl/EdggPHirGnuxb3fP9<br>-<br>𝙄𝙏𝙀𝙈 𝙄𝙎𝙏𝙄𝙈𝙀𝙒𝘼<br>➖➖➖➖➖<br>✔ Kos Penilai<br>✔ Deposit Elektrik Dan Air<br>✔ Kipas Remote, Kipas Regulator, Lampu Downlight<br>✔ Point Aircond Untuk Ruang Tamu, Master Bedroom<br>✔ Point plug, point Astro<br>✔ Siling Kapur Diseluruh Ruang<br>✔ Mozek / Tile Diseluruh Ruang<br>✔ Table Top Dan Sinki Dapur <br>.<br>Call/Wasap 0199804153",,,,House,335000.0,"RM 335,000",MYR,,terengganu,Besut,Terengganu,,,,,For Sale,bungalow,,1500,,,4,3,,,,,,,,,,,,,,,,,,4.0,,,,,,,,,,,,,"[""https://cdn.rnudah.com/images/plain/67d1fdb7a90a216b4b155049bc26574a-2932475953924344652.jpg""]",1,,,,,,,,,,,"Bungalow House for Sale, 4 Bedroom, 1500 sq.ft, Besut, Terengganu 109119333 | Mudah.my","Explore Bungalow House for Sale for RM 335,000 1 unit Akhir Banglo Telaga Putat, Setiu in Besut, Terengganu. 1500 sq.ft, 4 Bedroom, 3 Bathroom, Freehold, ID 109119333. Find your next property on Mudah.my.",https://cdn.rnudah.com/images/plain/67d1fdb7a90a216b4b155049bc26574a-2932475953924344652.jpg,"Explore Bungalow House for Sale for RM 335,000 1 unit Akhir Banglo Telaga Putat, Setiu in Besut, Terengganu. 1500 sq.ft, 4 Bedroom, 3 Bathroom, Freehold, ID 109119333. Find your next property on Mudah.my.",mudah.my,2026-05-29T05:31:12.490153+00:00,
https://www.mudah.my/1-unit-banglo-200-meter-dari-sekolah-intan-zahra-i-z-112907870.htm,https://www.mudah.my/1-unit-banglo-200-meter-dari-sekolah-intan-zahra-i-z-112907870.htm,132720789,1 Unit Banglo 200 Meter Dari Sekolah Intan Zahra (I Z ),"SALAM WARGA DUNGUN & PENGGUNA MUDAH….<br><br>1 Last Unit Banglo Akan Di Bina🏠<br><br>Di buka untuk tempahan & Jualan<br><br>###############################<br><br><br>LOKASI GRED A  :<br><br>- 100 Meter dekat SURAU ABDULSOLEH<br><br>-DALAM BANDAR DUNGUN<br> ( DEKAT IPD BALAI POLIS DUNGUN )<br><br>-Boleh shortcut keluar ke  JALAN BALAI BESAR <br><br><br><br>################################<br><br>PROPOSE <br>Saiz RUMAH :-🏡<br><br>KELUASAN RUMAH - 1,000KP <br>(STANDARD BANGLO)<br><br>BOLEH UBAH PLAN JIKA BERMINAT <br><br>BASIC PROPOSE<br>Pelan Dalaman <br><br>3 BILIK<br>2 BILIK AIR<br>1 FAMLY AREA<br>1 LIVING AREA<br>1 KICTHEN<br>1 VERANDA<br><br>PEMILIHAN LAIN2 DESIGN RUMAH , MASIH BOLEH UBAH & PEMBELI BOLEH BUAT PILIHAN LAGI MENGIKUT CITARASA PEMBELI<br>_______________________________________________<br><br>KELUASAN TANAH- <br><br>Lot 1= 434m @ 4,6700kaki/segi<br>( Lot ke-3  )<br><br>- Kanan & kiri sudah ada banglo bersebelahan <br><br>HALAMAN RESERVE BAKI 20 kaki <br>_____________________________________________<br><br>Harga <br><br>RM 367,000<br>RM 367, 000<br>RM 367, 000<br><br>Boleh Makeup Loan<br><br>################################<br><br><br>PINJAMAN :- <br><br>BANK <br> LPPSA <br>-Pihak Kami URUSKAN <br><br>Pembelian Tunai-<br>Ikut progress peratusan binaan …<br>- Ada free Gilf <br><br><br>###############################<br><br>BERMINAT <br><br>CALL / WSUP : 01125618732<br>CALL / WSUP : 01125618732<br>CALL / WSUP : 01125618732<br><br>Site Manager ; En.Ro📞📞📞📞📞📞<br><br><br>NOTE : <br><br>plan lokasi, plan lot & sample rumah dalaman seperti gambar diatas yg telah kami bina …..",,,,House,395000.0,"RM 395,000",MYR,,terengganu,Dungun,Terengganu,,,,,For Sale,bungalow,,1003,,,3,2,,,,,,,,,,,,,,,,,,4.0,,,,,,,,,,,,,"[""https://cdn.rnudah.com/images/plain/76d5dd1d1749d8360fcaa19d9ece0e7f-2953904664812725503.jpg""]",1,,,,,,,,11,,,"Bungalow House for Sale, 3 Bedroom, 1003 sq.ft, Dungun, Terengganu 112907870 | Mudah.my","Explore Bungalow House for Sale for RM 395,000 1 Unit Banglo 200 Meter Dari Sekolah Intan Zahra (I Z ) in Dungun, Terengganu. 1003 sq.ft, 3 Bedroom, 2 Bathroom, Freehold, ID 112907870. Find your next property on Mudah.my.",https://cdn.rnudah.com/images/plain/76d5dd1d1749d8360fcaa19d9ece0e7f-2953904664812725503.jpg,"Explore Bungalow House for Sale for RM 395,000 1 Unit Banglo 200 Meter Dari Sekolah Intan Zahra (I Z ) in Dungun, Terengganu. 1003 sq.ft, 3 Bedroom, 2 Bathroom, Freehold, ID 112907870. Find your next property on Mudah.my.",mudah.my,2026-05-29T05:31:04.007131+00:00,
https://www.mudah.my/1-unit-banglo-split-level-depan-rumah-padi-kubang-parit-terengganu-114763725.htm,https://www.mudah.my/1-unit-banglo-split-level-depan-rumah-padi-kubang-parit-terengganu-114763725.htm,134789925,"1 UNiT BANGLO SPLIT LEVEL DEPAN RUMAH PADI KUBANG PARIT, TERENGGANU","BANGLO RUMAH PADI<br><br>SALAM WARGA GANU KITE:-<br><br>1 UNIT BANGLO 1 Tingkat Setengah…<br><br>Di Buka Untuk Tempahan & Jualan<br><br>##############################<br><br>Propose Design :<br><br>Moden Klasik<br><br>KELUASAN RUMAH  :- 1,500kaki/persegi<br>- 4 Bilik <br>-3 Bilik Air <br>-1 Veranda<br>- 1 Family Area<br>- 1 Living Area<br>- 1 Guest Area<br><br>KELUASAN TANAH :- 549m@(+-)6,000kaki/segi<br>- Tanah Luas<br>- Ada Halaman Luas<br>- Boleh Buat HOMESTAY (TINY HOUSE ) <br><br>-DESING RUMAH MASIH BOLEH BUAT PILIHAN <br>  IKUT KEHENDAK & CITARSA  PEMBELI <br><br>#################################<br><br>Lokasi CANTIK :- <br><br>- Lot pertama Jalan Masuk ke RUMAH PADI <br>-700Meter Dari Sekolah Menengah Seri Nilam<br>-4KM ke MYDIN MALL KT BUKIT BESAR <br>-Hanya 5-10 Minit Ke DRAWBRIGE & BANDAR<br>- JALAN BERTAR KE TAPAK TANAH<br><br>#################################<br><br>HARGA ( BOLEH RUNDING )<br><br>RM 477,000  <br>RM 477,000  <br>RM 477,000  <br><br>Berminat :-<br><br> ( Boleh Site Visit ) <br>- Tengok kawasan persekitaran<br><br>Call @ Wssup / <br>01125618732 📞📞📞📞📞<br>01125618732 📞📞📞📞📞<br>01125618732 📞📞📞📞📞<br><br>En.Ro :- PENGURUS<br><br>SYARIKAT BERDAFTAR-<br><br>ARDA RESOURCES (G2)<br>-CiDB-( 0120251006-TR 161810 )<br><br>-LPPSA (MOF )<br>-Panel Bank<br><br>################################<br><br>Pinjaman Di Uruskan <br>LPPSA @ BANK<br><br>( KAMI BINA RUMAH BARU ) <br><br>- GAMBAR BANGLO DI ATAS CONTOH YG KAMI <br>   TELAH BINA SIAP 100%",,,,House,477000.0,"RM 477,000",MYR,,terengganu,Kuala Terengganu,Terengganu,,,,,For Sale,bungalow,,1500,,,4,3,,,,,,,,,,,,,,,,,,4.0,,,,,,,,,,,,,"[""https://cdn.rnudah.com/images/plain/818f250feb713bce6c75ed2a1e3610d8-2984333136963803845.jpg"", ""https://cdn.rnudah.com/images/plain/3030df07f86a7c692f034c2bca9d6d98-2984333145805920965.jpg"", ""https://cdn.rnudah.com/images/plain/d574511aa2129d3ec110b37db0d6966e-2984333135031002303.jpg"", ""https://cdn.rnudah.com/images/plain/181abf3ed91b22ebc9ffb1f9eaa7febd-2984333194208647877.jpg"", ""https://cdn.rnudah.com/images/plain/663927d261fe065c5b8ecd7970bfbcd2-2984333143908261005.jpg""]",5,,,,,,,,11,,,"Bungalow House for Sale, 4 Bedroom, 1500 sq.ft, Kuala Terengganu, Terengganu 114763725 | Mudah.my","Explore Bungalow House for Sale for RM 477,000 1 UNiT BANGLO SPLIT LEVEL DEPAN RUMAH PADI KUBANG PARIT, TERENGGANU in Kuala Terengganu, Terengganu. 1500 sq.ft, 4 Bedroom, 3 Bathroom, Freehold, ID 114763725. Find your next property on Mudah.my.",https://cdn.rnudah.com/images/plain/818f250feb713bce6c75ed2a1e3610d8-2984333136963803845.jpg,"Explore Bungalow House for Sale for RM 477,000 1 UNiT BANGLO SPLIT LEVEL DEPAN RUMAH PADI KUBANG PARIT, TERENGGANU in Kuala Terengganu, Terengganu. 1500 sq.ft, 4 Bedroom, 3 Bathroom, Freehold, ID 114763725. Find your next property on Mudah.my.",mudah.my,2026-05-29T05:31:05.290130+00:00,
https://www.mudah.my/banglo-kampung-air-chukai-114877684.htm,https://www.mudah.my/banglo-kampung-air-chukai-114877684.htm,134915869,"Banglo Kampung Air, Chukai","LAGI TURUN HARGA <br><br>Rumah Banglo di Kampung Air , Chukai Kemaman <br><br>Butiran: <br>- Freehold<br>- Rizab Melayu<br>- Luas tanah 642m2/6921sqft<br>- Luas binaan :  1819 kps<br>- 4 bilik, 3 tandas<br>- Corner Lot <br><br>Kemudahan <br>- 900m ke Surau Hijau Mak Chili<br>- 1.2km ke SK Seri Iman<br>- 2.7km ke SMK Sultan Ismail<br>- 1.6km ke SMA Al-Falah<br>- 2.8km ke Hospital Chukai Kemaman<br><br>Harga: RM420,000 <br><br>Najmi Che Seman (REN 59388)<br>019—-999—3276",,,,House,420000.0,"RM 420,000",MYR,,terengganu,Chukai,Terengganu,,59388,,,For Sale,bungalow,,1819,,,4,3,,,,,,,,,,,,,,,,,,4.0,,,,,,,,,,,,,"[""https://cdn.rnudah.com/images/plain/697e95d2b2909d9582c6896a5519dcb7-2986308325215890725.jpg"", ""https://cdn.rnudah.com/images/plain/43f1fb9d8fb678acd1ff36c509022980-2986308325968753825.jpg"", ""https://cdn.rnudah.com/images/plain/a70c12d42266149709fe9e8a47ca6b01-2986308325256391696.jpg"", ""https://cdn.rnudah.com/images/plain/f8645359855009a04e88ff32ca2ce95f-2986308326296841232.jpg"", ""https://cdn.rnudah.com/images/plain/837c1e8cf1ffbb1b627cd14ca1b28f48-2986308326284924186.jpg""]",5,,,,,59388,"E - 11959, REN 59388 All ads from this advertiser (54 For Sale) Mortgage Estimation RM 1,674 Estimated monthly installment (Interest rate 4.0%) Property Price Loan Interest (%) Loan Amount Loan Tenure (Ye * This is for reference only and is not a quote. Results vary according to different financial institutions. Mudah.my doesn't guarantee it's accuracy or applicability to your circumstances. Is this your ad? Manage it using these links: Edit Delete Sold Bump Share This Ad Is this ad suspicious or inappropriate? Report this Ad ( List-ID: 114877684 ) Contact Agent Muhammad Najmi b Che Seman Property agent – Agent ID Checked Landsworth Properties Sdn Bhd Firm: E - 11959, REN 59388 All ads from this advertiser (54 For Sale) Mortgage Estimation RM 1,674 Estimated monthly installment (Interest rate 4.0%) Property Price Loan Interest (%) Loan Amount Loan Tenure (Ye * This is for reference only and is not a quote. Results vary according to different financial institutions. Mudah.my doesn't guarantee it's accuracy or applicability to your circumstances. Is this your ad? Manage it using these links: Edit Delete Sold Bump Share This Ad Is this ad suspicious or inappropriate? Report this Ad ( List-ID: 114877684 ) More picks below Back to Top",True,54,,,"Bungalow House for Sale, 4 Bedroom, 1819 sq.ft, Chukai, Terengganu 114877684 | Mudah.my","Explore Bungalow House for Sale for RM 420,000 Banglo Kampung Air, Chukai in Chukai, Terengganu. 1819 sq.ft, 4 Bedroom, 3 Bathroom, Freehold, ID 114877684. Find your next property on Mudah.my.",https://cdn.rnudah.com/images/plain/697e95d2b2909d9582c6896a5519dcb7-2986308325215890725.jpg,"Explore Bungalow House for Sale for RM 420,000 Banglo Kampung Air, Chukai in Chukai, Terengganu. 1819 sq.ft, 4 Bedroom, 3 Bathroom, Freehold, ID 114877684. Find your next property on Mudah.my.",mudah.my,2026-05-29T05:31:05.907136+00:00,
https://www.mudah.my/banglo-kg-baru-kerteh-114877689.htm,https://www.mudah.my/banglo-kg-baru-kerteh-114877689.htm,134915910,Banglo Kg Baru Kerteh,"Banglo Kg Baru Kerteh<br><br>BUTIRAN:<br>- Freehold | Rezab Melayu <br>- 5 bilik | 4 bilik air 1 stor<br>- Luas tanah : 660 mps /  7104kps<br>- Free aircond 4 biji<br><br>Kemudahan :<br>- Pantai Kuala Kerteh - 5.7km / 9min<br>- Stesen minyak Shell - 550m / 1min<br>- Masjid Tengku Mizan Zainal Abidin - 3.3km / 8min<br>- SK / SMK Kerteh - 3.8km / 9min<br>- Mesra Mall / Maybank / Cimb - 5.5km / 8min<br>- Bebas Banjir<br><br>Harga : RM 495,000<br><br>Najmi Che Seman (REN 59388)<br>019-999 3276",,,,House,495000.0,"RM 495,000",MYR,,terengganu,Kerteh,Terengganu,,59388,,,For Sale,bungalow,,7104,,,5,4,,,,,,,,,,,,,,,,,,4.0,,,,,,,,,,,,,"[""https://cdn.rnudah.com/images/plain/329a91462c4174b2d3f42f70ad94cda5-2986309058325245221.jpg""]",1,,,,,59388,"E - 11959, REN 59388 All ads from this advertiser (54 For Sale) Mortgage Estimation RM 1,973 Estimated monthly installment (Interest rate 4.0%) Property Price Loan Interest (%) Loan Amount Loan Tenure (Ye * This is for reference only and is not a quote. Results vary according to different financial institutions. Mudah.my doesn't guarantee it's accuracy or applicability to your circumstances. Is this your ad? Manage it using these links: Edit Delete Sold Bump Share This Ad Is this ad suspicious or inappropriate? Report this Ad ( List-ID: 114877689 ) Contact Agent Muhammad Najmi b Che Seman Property agent – Agent ID Checked Landsworth Properties Sdn Bhd Firm: E - 11959, REN 59388 All ads from this advertiser (54 For Sale) Mortgage Estimation RM 1,973 Estimated monthly installment (Interest rate 4.0%) Property Price Loan Interest (%) Loan Amount Loan Tenure (Ye * This is for reference only and is not a quote. Results vary according to different financial institutions. Mudah.my doesn't guarantee it's accuracy or applicability to your circumstances. Is this your ad? Manage it using these links: Edit Delete Sold Bump Share This Ad Is this ad suspicious or inappropriate? Report this Ad ( List-ID: 114877689 ) More picks below Back to Top",True,54,,,"Bungalow House for Sale, 5 Bedroom, 7104 sq.ft, Kerteh, Terengganu 114877689 | Mudah.my","Explore Bungalow House for Sale for RM 495,000 Banglo Kg Baru Kerteh in Kerteh, Terengganu. 7104 sq.ft, 5 Bedroom, 4 Bathroom, Freehold, ID 114877689. Find your next property on Mudah.my.",https://cdn.rnudah.com/images/plain/329a91462c4174b2d3f42f70ad94cda5-2986309058325245221.jpg,"Explore Bungalow House for Sale for RM 495,000 Banglo Kg Baru Kerteh in Kerteh, Terengganu. 7104 sq.ft, 5 Bedroom, 4 Bathroom, Freehold, ID 114877689. Find your next property on Mudah.my.",mudah.my,2026-05-29T05:31:05.604133+00:00,
https://www.mudah.my/banglo-tok-dor-jabi-dekat-dengan-jalan-besar-petron-jabi-107675654.htm,https://www.mudah.my/banglo-tok-dor-jabi-dekat-dengan-jalan-besar-petron-jabi-107675654.htm,126927055,"Banglo Tok Dor, Jabi (dekat dengan jalan besar Petron Jabi)","𝗢𝗣𝗘𝗡 𝗕𝗢𝗢𝗞𝗜𝗡𝗚<br>1 𝗨𝗻𝗶𝘁 𝗕𝗮𝗻𝗴𝗹𝗼 𝗧𝗼𝗸 𝗗𝗼𝗿, 𝗕𝗲𝘀𝘂𝘁<br>-<br>💲 Harga RM305,000<br>🏡Luas Rumah 1250kp<br>📍Luas Tanah 556mp (5985kp)<br>🚪3 Bilik 🚽 2 Bilik air<br>📌Lokasi: https://maps.app.goo.gl/39eWcUDmNqrDeT3ZA<br>.<br>𝙄𝙏𝙀𝙈 𝙄𝙎𝙏𝙄𝙈𝙀𝙒𝘼<br>➖➖➖➖➖<br>✔ Kos Penilai<br>✔ Deposit Elektrik Dan Air<br>✔ Kipas Remote, Kipas Regulator, Lampu Downlight<br>✔ Point Aircond Untuk Ruang Tamu, Master Bedroom<br>✔ Point plug, point Astro<br>✔ Siling Kapur Diseluruh Ruang<br>✔ Mozek / Tile Diseluruh Ruang<br>✔ Table Top Dan Sinki Dapur<br>.<br>Call/Wasap: 0199804153",,,,House,305000.0,"RM 305,000",MYR,,terengganu,Besut,Terengganu,,,,,For Sale,bungalow,,1250,,,3,2,,,,,,,,,,,,,,,,,,4.0,,,,,,,,,,,,,"[""https://cdn.rnudah.com/images/plain/5127297f37d15fa8bceeae12708a972f-2889296329508792178.jpg""]",1,,,,,,,,,,,"Bungalow House for Sale, 3 Bedroom, 1250 sq.ft, Besut, Terengganu 107675654 | Mudah.my","Explore Bungalow House for Sale for RM 305,000 Banglo Tok Dor, Jabi (dekat dengan jalan besar Petron Jabi) in Besut, Terengganu. 1250 sq.ft, 3 Bedroom, 2 Bathroom, Freehold, ID 107675654. Find your next property on Mudah.my.",https://cdn.rnudah.com/images/plain/5127297f37d15fa8bceeae12708a972f-2889296329508792178.jpg,"Explore Bungalow House for Sale for RM 305,000 Banglo Tok Dor, Jabi (dekat dengan jalan besar Petron Jabi) in Besut, Terengganu. 1250 sq.ft, 3 Bedroom, 2 Bathroom, Freehold, ID 107675654. Find your next property on Mudah.my.",mudah.my,2026-05-29T05:31:11.651154+00:00,
https://www.mudah.my/bungalow-tepi-pantai-untuk-dijual-114539685.htm,https://www.mudah.my/bungalow-tepi-pantai-untuk-dijual-114539685.htm,134535845,Bungalow tepi pantai untuk dijual.,"Pantai Penunjuk, Kijal, Kemaman Trengganu<br><br>- 2.5year old bungalow 2 tingkat<br><br>- 4 bilik with attached bathroom(2 downstairs+2 upstairs)<br><br> -total built-up 4280 sq feet<br><br> - total land area 12550 sq ft( 1166 sq m)(2lots)<br><br> -partly furnished<br><br> -self-designed by owner<br><br> -high built quality and material used<br><br> -1st lot tepi pantai<br><br> -extra big , wide and windy verandah<br><br> -free million-dollar view of South China Sea<br><br> -spacious front yard for future built(eg swimming pool,chalet,bbq pit ect)<br><br> -exellent access(tepi jalan pantai)<br><br> -exellent neibourhood(dalam kawasan kampung)<br><br> -geran satu nama<br><br> -details tanah ada dalam gambar geran<br><br> -harga 1.25m( negotiable)<br><br> -contact owner 012-6707404(SMS atau WhatsApp only please)",,,,House,1250000.0,"RM 1,250,000",MYR,,terengganu,Kijal,Terengganu,,12550,,,For Sale,bungalow,,4280,,,4,4,,,,,,,,,,,,,,,,,,4.0,,,,,,,,,,,,,"[""https://cdn.rnudah.com/images/plain/3578946fc7cd34038288979b4fa87d30-2980768725856892280.jpg""]",1,,,,,,,,,,,"Bungalow House for Sale, 4 Bedroom, 4280 sq.ft, Kijal, Terengganu 114539685 | Mudah.my","Explore Bungalow House for Sale for RM 1,250,000 Bungalow tepi pantai untuk dijual. in Kijal, Terengganu. 4280 sq.ft, 4 Bedroom, 4 Bathroom, Freehold, ID 114539685. Find your next property on Mudah.my.",https://cdn.rnudah.com/images/plain/3578946fc7cd34038288979b4fa87d30-2980768725856892280.jpg,"Explore Bungalow House for Sale for RM 1,250,000 Bungalow tepi pantai untuk dijual. in Kijal, Terengganu. 4280 sq.ft, 4 Bedroom, 4 Bathroom, Freehold, ID 114539685. Find your next property on Mudah.my.",mudah.my,2026-05-29T05:31:07.613139+00:00,
https://www.mudah.my/rumah-banglo-kuala-terengganu-114047797.htm,https://www.mudah.my/rumah-banglo-kuala-terengganu-114047797.htm,133987102,Rumah Banglo Kuala Terengganu,"Keluasan:505m/5435ft<br>Tanah ada free lagi untuk buat sebuah lg rumah.<br>Tanah lot dlm geran besar ada 3 nama.Tanah dan rumah atas nama owner.5bilik 3<br>bilik air.Jarak ke Pusat Bandar Kuala Terengganu 4km.<br>Harga jualan RM380,000.Status tanah bangunan.<br>Rumah berhadapan giant dan mydin hiliran<br>Berminat :http://wasap.my/60133880774",,,,House,380000.0,"RM 380,000",MYR,,terengganu,Kuala Terengganu,Terengganu,,,,,For Sale,bungalow,,5350,,,5,3,,,,,,,,,,,,,,,,,,4.0,,,,,,,,,,,,,"[""https://cdn.rnudah.com/images/plain/66ead24af9065acbba4d884444da5b46-2972084057835281381.jpg"", ""https://cdn.rnudah.com/images/plain/d52f4e3ca86f28048c7ce61054446880-2972084059307501742.jpg"", ""https://cdn.rnudah.com/images/plain/eab7e22e74bd3d0d2d1642e757d902ae-2972084061073349605.jpg"", ""https://cdn.rnudah.com/images/plain/5fc4b7a36313111561ea27da52335001-2972084063015332014.jpg"", ""https://cdn.rnudah.com/images/plain/626fcdb596ed14d2fe20418780d98660-2972084064730848229.jpg"", ""https://mcdn.mudah.my/static-assets/images/adview/freehold.svg"", ""https://mcdn.mudah.my/static-assets/images/adview/road.svg"", ""https://mcdn.mudah.my/static-assets/images/adview/stores.svg"", ""https://www.facebook.com/tr?id=632307416906311&ev=ViewContent&cd[content_type]=product&cd[content_ids]=114047797&cd[value]=380000&cd[currency]=MYR&cd[content_category]=2000%20%7C%20properties&noscript=1""]",9,,,,,,,,,,,"Bungalow House for Sale, 5 Bedroom, 5350 sq.ft, Kuala Terengganu, Terengganu 114047797 | Mudah.my","Explore Bungalow House for Sale for RM 380,000 Rumah Banglo Kuala Terengganu in Kuala Terengganu, Terengganu. 5350 sq.ft, 5 Bedroom, 3 Bathroom, Freehold, ID 114047797. Find your next property on Mudah.my.",https://cdn.rnudah.com/images/plain/66ead24af9065acbba4d884444da5b46-2972084057835281381.jpg,"Explore Bungalow House for Sale for RM 380,000 Rumah Banglo Kuala Terengganu in Kuala Terengganu, Terengganu. 5350 sq.ft, 5 Bedroom, 3 Bathroom, Freehold, ID 114047797. Find your next property on Mudah.my.",mudah.my,2026-05-29T05:59:01.360442+00:00,
https://www.mudah.my/rumah-bungalow-setingkat-bukit-payung-marang-freehold-114874310.htm,https://www.mudah.my/rumah-bungalow-setingkat-bukit-payung-marang-freehold-114874310.htm,134912981,Rumah Bungalow Setingkat Bukit Payung Marang Freehold🔥,"Bungalow Bukit Payung Marang<br>Harga Lelong RM262,440<br>Harga Pasaran RM400,000<br>Tarikh Lelong 6 Julai 2026<br>Deposit Diperlukan 10%<br><br>Alamat Hartanah:<br>Lot 91153, Bukit Payung, Kampung Tebakang, Marang, Terengganu<br><br>Location Map: wasap.my/60196609212/AgentRizal<br><br>Butiran Hartanah:<br>Rumah Bungalow Setingkat<br>Keluasan : 5,026 kaki persegi<br>Pegangan: Freehold<br>Sekatan: Rizab Melayu<br><br>Note: Hartanah akan dijual dalam keadaan ""seadanya / as is"" & tertakluk kepada Terma di dalam Syarat Jualan Lelong (POS)<br><br>☎️ Hubungi Agent 👇<br>wasap.my/60196609212/AgentRizal<br><br><br>#HotListing🔥",,,,House,262440.0,"RM 262,440",MYR,,terengganu,Marang,Terengganu,,91153,,,For Sale,bungalow,,5026,,,4,3,,,,,,,,,,,,,,,,,,,,,,,,,,,,,,,"[""https://cdn.rnudah.com/images/plain/9e7b32aaef40437b97bc6836336c65f0-2986272559659871248.jpg""]",1,,,,,01457,"E - 31787, REN 01457 All ads from this advertiser (11 For Sale, 6 For Rent) Is this your ad? Manage it using these links: Edit Delete Sold Bump Share This Ad Is this ad suspicious or inappropriate? Report this Ad ( List-ID: 114874310 ) Contact Agent Mohamad Rizal Dzulkafli Property agent – Agent ID Checked Glory Lands & Properties Firm: E - 31787, REN 01457 All ads from this advertiser (11 For Sale, 6 For Rent) Is this your ad? Manage it using these links: Edit Delete Sold Bump Share This Ad Is this ad suspicious or inappropriate? Report this Ad ( List-ID: 114874310 ) More picks below Back to Top",True,11,,,"Bungalow House for Auction, 4 Bedroom, 5026 sq.ft, Marang, Terengganu 114874310 | Mudah.my","Explore Bungalow House for Auction for RM 262,440 Rumah Bungalow Setingkat Bukit Payung Marang Freehold🔥 in Marang, Terengganu. 5026 sq.ft, 4 Bedroom, 3 Bathroom, Freehold, ID 114874310. Find your next property on Mudah.my.",https://cdn.rnudah.com/images/plain/9e7b32aaef40437b97bc6836336c65f0-2986272559659871248.jpg,"Explore Bungalow House for Auction for RM 262,440 Rumah Bungalow Setingkat Bukit Payung Marang Freehold🔥 in Marang, Terengganu. 5026 sq.ft, 4 Bedroom, 3 Bathroom, Freehold, ID 114874310. Find your next property on Mudah.my.",mudah.my,2026-05-29T05:31:06.170138+00:00,
